House Index,Address,Price,County,Room,Approx price per room
"1. Apartment 12-09, The Arc, 2K Queens Road, Belfast, Belfast City Centre, Belfast, Co. Antrim - Apa","Apartment 12-09, The Arc, 2K Queens Road, Belfast, Belfast City Centre, Belfast, Co. Antrim",850970, Co. Antrim,2,425485.00
"1. Glynn, St. Mullins, Co. Carlow - Apa","Glynn, St. Mullins, Co. Carlow",700, Co. Carlow,4,175.00
"2. Ferry Bank, Graiguecullen, Co. Carlow - Apa","Ferry Bank, Graiguecullen, Co. Carlow",850, Co. Carlow,2,425.00
"3. Dublin Street, Carlow Town, Co. Carlow - Apa","Dublin Street, Carlow Town, Co. Carlow",850, Co. Carlow,3,283.33
"4. Riverdell, Haymarket, Carlow Town, Co. Carlow - Apa","Riverdell, Haymarket, Carlow Town, Co. Carlow",825, Co. Carlow,2,412.50
"5. Centaur House, Carlow Town, Co. Carlow - Apa","Centaur House, Carlow Town, Co. Carlow",950, Co. Carlow,2,475.00
"6. phelim crescent, Tullow, Co. Carlow - Apa","phelim crescent, Tullow, Co. Carlow",800, Co. Carlow,3,266.67
"7. Barrow Mews, Carlow Town, Co. Carlow - Apa","Barrow Mews, Carlow Town, Co. Carlow",750, Co. Carlow,1,750.00
"1. No. 10 Eaglewood, Belturbet, Co. Cavan - Apa","No. 10 Eaglewood, Belturbet, Co. Cavan",550, Co. Cavan,2,275.00
"2. Apt. 31 Railway Lough, Belturbet, Co. Cavan - Apa","Apt. 31 Railway Lough, Belturbet, Co. Cavan",450, Co. Cavan,1,450.00
"3. 13 Headford Grove, Virginia, Co. Cavan - Apa","13 Headford Grove, Virginia, Co. Cavan",800, Co. Cavan,3,266.67
"4. Lakelands, Virginia, Co. Cavan - Apa","Lakelands, Virginia, Co. Cavan",750, Co. Cavan,2,375.00
"5. Rivercrescent, Virginia, Co. Cavan - Apa","Rivercrescent, Virginia, Co. Cavan",550, Co. Cavan,1,550.00
"6. Main Street, Cavan, Co. Cavan - Apa","Main Street, Cavan, Co. Cavan",550, Co. Cavan,1,550.00
"7. Stramatt, Lisduff, Virginia, Co. Cavan - Apa","Stramatt, Lisduff, Virginia, Co. Cavan",900, Co. Cavan,3,300.00
"8. Deerpark, Virginia, Co. Cavan - Apa","Deerpark, Virginia, Co. Cavan",700, Co. Cavan,3,233.33
"9. Russell Quay, Ballyconnell, Co. Cavan, Ballyconnell, Co. Cavan - Apa","Russell Quay, Ballyconnell, Co. Cavan, Ballyconnell, Co. Cavan",685, Co. Cavan,2,342.50
"10. blacklion, Blacklion, Co. Cavan - Apar","blacklion, Blacklion, Co. Cavan",450, Co. Cavan,2,225.00
"11. Apt 7 Woodford View, Ballyconnell, Co. Cavan - Apar","Apt 7 Woodford View, Ballyconnell, Co. Cavan",550, Co. Cavan,2,275.00
"12. 2 Annalee Drive, Ballyhaise Cavan, Ballyhaise, Co. Cavan - Apar","2 Annalee Drive, Ballyhaise Cavan, Ballyhaise, Co. Cavan",600, Co. Cavan,2,300.00
"13. Poles, Cavan, Co. Cavan - Apar","Poles, Cavan, Co. Cavan",950, Co. Cavan,1,950.00
"1. Cuirt Na HEaglaise, Newmarket on Fergus, Co. Clare - Apa","Cuirt Na HEaglaise, Newmarket on Fergus, Co. Clare",800, Co. Clare,2,400.00
"2. Woodbrook, Newmarket on Fergus, Co. Clare - Apa","Woodbrook, Newmarket on Fergus, Co. Clare",650, Co. Clare,1,650.00
"3. Boheraroan, Newmarket on Fergus, Co. Clare - Apa","Boheraroan, Newmarket on Fergus, Co. Clare",800, Co. Clare,2,400.00
"4. 135 Bru na Sionna, Shannon, Co. Clare - Apa","135 Bru na Sionna, Shannon, Co. Clare",825, Co. Clare,2,412.50
"5. 10 Ros na Greine, Shannon, Co. Clare - Apa","10 Ros na Greine, Shannon, Co. Clare",1200, Co. Clare,5,240.00
"6. Merchants Quay, Kilrush, Co. Clare - Apa","Merchants Quay, Kilrush, Co. Clare",700, Co. Clare,2,350.00
"7. Riverwood Retirement village, Kilrush, Co. Clare - Apa","Riverwood Retirement village, Kilrush, Co. Clare",650, Co. Clare,1,650.00
"8. Bruagh Na Habhann, Quinn road, Ennis, Co. Clare - Apa","Bruagh Na Habhann, Quinn road, Ennis, Co. Clare",825, Co. Clare,2,412.50
"9. 1 Maple house Drumgeely, Shannon, Co. Clare - Apa","1 Maple house Drumgeely, Shannon, Co. Clare",700, Co. Clare,2,350.00
"10. Lahinch Road, Ennistymon, Ennistymon, Co. Clare - Apar","Lahinch Road, Ennistymon, Ennistymon, Co. Clare",600, Co. Clare,2,300.00
"11. Salthouse Lane, Ennis, Co. Clare - Apar","Salthouse Lane, Ennis, Co. Clare",800, Co. Clare,2,400.00
"12. Boheroan, Newmarket on Fergus, Co. Clare - Apar","Boheroan, Newmarket on Fergus, Co. Clare",800, Co. Clare,2,400.00
"13. Moore Street, Kilrush, Co. Clare - Apar","Moore Street, Kilrush, Co. Clare",400, Co. Clare,1,400.00
"14. Apartment 1, Garna House Retail Centre, Sixmilebridge, Co. Clare - Apar","Apartment 1, Garna House Retail Centre, Sixmilebridge, Co. Clare",800, Co. Clare,3,266.67
"15. 3 Merchant's Quay, Kilrush, Co. Clare - Apar","3 Merchant's Quay, Kilrush, Co. Clare",360, Co. Clare,1,360.00
"1. South Douglas Road, Cork City, Co. Cork - Apa","South Douglas Road, Cork City, Co. Cork",1440, Co. Cork,2,720.00
"2. Orchard Court, Victoria Cross, Victoria Cross, Co. Cork - Apa","Orchard Court, Victoria Cross, Victoria Cross, Co. Cork",1373, Co. Cork,2,686.50
"3. 24 Ronayns Court, Rochestown Road, Douglas, Co. Cork - Apa","24 Ronayns Court, Rochestown Road, Douglas, Co. Cork",1500, Co. Cork,2,750.00
"4. Douglas House, Douglas, Co. Cork - Apa","Douglas House, Douglas, Co. Cork",1400, Co. Cork,2,700.00
"5. 24 Rivergold, Lavitts Quay, Cork City, Co. Cork - Apa","24 Rivergold, Lavitts Quay, Cork City, Co. Cork",1350, Co. Cork,1,1350.00
"6. Camden Court , Carolls Quay , Cork ., Cork City, Co. Cork - Apa","Camden Court , Carolls Quay , Cork ., Cork City, Co. Cork",1600, Co. Cork,2,800.00
"7. Eagle Valley, Wilton, Co. Cork - Apa","Eagle Valley, Wilton, Co. Cork",1500, Co. Cork,4,375.00
"8. River Towers, Lee Road, Cork City, Co. Cork - Apa","River Towers, Lee Road, Cork City, Co. Cork",2550, Co. Cork,1,2550.00
"9. The Coach House, Belvidere Farm, ballycurreen, Farmers Cross, Co. Cork - Apa","The Coach House, Belvidere Farm, ballycurreen, Farmers Cross, Co. Cork",1200, Co. Cork,2,600.00
"10. South Terrace, Cork City, Co. Cork - Apar","South Terrace, Cork City, Co. Cork",1250, Co. Cork,1,1250.00
"11. 11 Blackrock Grove, Eden, Blackrock, Co. Cork - Apar","11 Blackrock Grove, Eden, Blackrock, Co. Cork",1400, Co. Cork,2,700.00
"12. 48 Mill House, Mill Road, Midleton, Co. Cork - Apar","48 Mill House, Mill Road, Midleton, Co. Cork",1150, Co. Cork,2,575.00
"13. Cloghroe House, Ballincollig, Co. Cork - Apar","Cloghroe House, Ballincollig, Co. Cork",825, Co. Cork,1,825.00
"14. Corrin Court, Cork Road, Fermoy, Co. Cork - Apar","Corrin Court, Cork Road, Fermoy, Co. Cork",795, Co. Cork,2,397.50
"15. Blarney Street, Cork City, Co. Cork - Apar","Blarney Street, Cork City, Co. Cork",1260, Co. Cork,2,630.00
"16. Kingsbridge, South Douglas Road, Douglas, Co. Cork - Apar","Kingsbridge, South Douglas Road, Douglas, Co. Cork",1440, Co. Cork,2,720.00
"17. Granary Hall, Mount Oval, Rochestown, Co. Cork - Apar","Granary Hall, Mount Oval, Rochestown, Co. Cork",1350, Co. Cork,2,675.00
"18. Tivoli Woods, Tivoli, Co. Cork - Apar","Tivoli Woods, Tivoli, Co. Cork",1050, Co. Cork,2,525.00
"19. Maryborough Ridge, Douglas, Co. Cork - Apar","Maryborough Ridge, Douglas, Co. Cork",1620, Co. Cork,3,540.00
"20. The Crescent, Cork City, Co. Cork - Apar","The Crescent, Cork City, Co. Cork",1305, Co. Cork,2,652.50
"1. 2 Railway Court, Pearse Road, Letterkenny, Co. Donegal - Apa","2 Railway Court, Pearse Road, Letterkenny, Co. Donegal",650, Co. Donegal,2,325.00
"2. Apt 4, Main St, St. Johnston, Co. Donegal - Apa","Apt 4, Main St, St. Johnston, Co. Donegal",390, Co. Donegal,1,390.00
"3. 21 Quayside Apartments, Ramelton, Co. Donegal - Apa","21 Quayside Apartments, Ramelton, Co. Donegal",850, Co. Donegal,3,283.33
"4. 18 The Fort, Greencastle, Co. Donegal - Apa","18 The Fort, Greencastle, Co. Donegal",750, Co. Donegal,3,250.00
"5. 49 Grand Central Apartments, Letterkenny, Co. Donegal - Apa","49 Grand Central Apartments, Letterkenny, Co. Donegal",650, Co. Donegal,2,325.00
"6. Trentaboy, Drumkeen, Co. Donegal - Apa","Trentaboy, Drumkeen, Co. Donegal",600, Co. Donegal,1,600.00
"7. Apt 1 86 Upper Main street, Letterkenny, Co. Donegal - Apa","Apt 1 86 Upper Main street, Letterkenny, Co. Donegal",600, Co. Donegal,2,300.00
"8. 14 Glenveagh Court, Letterkenny, Co. Donegal - Apa","14 Glenveagh Court, Letterkenny, Co. Donegal",800, Co. Donegal,3,266.67
"9. The Maples, Lismonaghan, Letterkenny, Co. Donegal - Apa","The Maples, Lismonaghan, Letterkenny, Co. Donegal",565, Co. Donegal,1,565.00
"10. Apt 7 The Gallery, Navenny Street, Ballybofey, Co. Donegal - Apar","Apt 7 The Gallery, Navenny Street, Ballybofey, Co. Donegal",520, Co. Donegal,2,260.00
"11. 31 Cill Greine, Letterkenny, Co. Donegal - Apar","31 Cill Greine, Letterkenny, Co. Donegal",600, Co. Donegal,2,300.00
"12. Aras Patrick Kavanagh, Letterkenny, Co. Donegal - Apar","Aras Patrick Kavanagh, Letterkenny, Co. Donegal",845, Co. Donegal,1,845.00
"13. 6 Church Lane Apt, Letterkenny, Co. Donegal - Apar","6 Church Lane Apt, Letterkenny, Co. Donegal",650, Co. Donegal,2,325.00
"14. riverside, Letterkenny, Co. Donegal - Apar","riverside, Letterkenny, Co. Donegal",520, Co. Donegal,2,260.00
"15. St Annes Court, Letterkenny, Co. Donegal - Apar","St Annes Court, Letterkenny, Co. Donegal",550, Co. Donegal,2,275.00
"16. Ardmore Court, Upper Main Street, Ballyshannon, Co. Donegal - Apar","Ardmore Court, Upper Main Street, Ballyshannon, Co. Donegal",550, Co. Donegal,2,275.00
"17. 1 Bakers Court, Ballyshannon, Co. Donegal - Apar","1 Bakers Court, Ballyshannon, Co. Donegal",550, Co. Donegal,2,275.00
"18. Apt 2 William Street, Raphoe, Co. Donegal - Apar","Apt 2 William Street, Raphoe, Co. Donegal",320, Co. Donegal,1,320.00
"19. Riverside View, Letterkenny, Co. Donegal - Apar","Riverside View, Letterkenny, Co. Donegal",440, Co. Donegal,2,220.00
"20. The Barn, Killylastin, Letterkenny, Co. Donegal - Apar","The Barn, Killylastin, Letterkenny, Co. Donegal",500, Co. Donegal,1,500.00
"1. 7 Carlinn's Cove, Rostrevor, Co. Down - Apa","7 Carlinn's Cove, Rostrevor, Co. Down",700799, Co. Down,3,233599.67
"1. 20 Belfield Park, Stillorgan, Co. Dublin - Apa","20 Belfield Park, Stillorgan, Co. Dublin",2100, Co. Dublin,2,1050.00
"2. Shelbourne Road Apartments, Ballsbridge, Dublin 4 - Apa","Shelbourne Road Apartments, Ballsbridge, Dublin 4",3600, Dublin 4,2,1800.00
"3. The Grange, Brewery Road, Stillorgan, Co. Dublin - Apa","The Grange, Brewery Road, Stillorgan, Co. Dublin",1950, Co. Dublin,2,975.00
"4. Inglenook Wood, Glenamuck Road, Carrickmines, Carrickmines, Dublin 18 - Apa","Inglenook Wood, Glenamuck Road, Carrickmines, Carrickmines, Dublin 18",2100, Dublin 18,2,1050.00
"5. Cathedral Court, Dublin 2 - Apa","Cathedral Court, Dublin 2",2800, Dublin 2,2,1400.00
"6. Cathedral Court, Dublin 2 - Apa","Cathedral Court, Dublin 2",2250, Dublin 2,1,2250.00
"7. Capital Dock, Sir John Rogerson's Quay, Grand Canal Dock, Dublin 2 - Apa","Capital Dock, Sir John Rogerson's Quay, Grand Canal Dock, Dublin 2",3300, Dublin 2,2,1650.00
"8. Vico Terrace, Vico Road, Dalkey, Co. Dublin - Apa","Vico Terrace, Vico Road, Dalkey, Co. Dublin",7000, Co. Dublin,3,2333.33
"9. Bushy Park House, Terenure, Dublin 6w - Apa","Bushy Park House, Terenure, Dublin 6w",1792, Dublin 6w,1,1792.00
"10. Adelaide Square, Dublin 2 - Apar","Adelaide Square, Dublin 2",3400, Dublin 2,2,1700.00
"11. Sweepstakes, Ballsbridge, Dublin 4 - Apar","Sweepstakes, Ballsbridge, Dublin 4",3000, Dublin 4,3,1000.00
"12. 30 The Marker residence, Grand Canal Dock, Dublin 2 - Apar","30 The Marker residence, Grand Canal Dock, Dublin 2",3535, Dublin 2,2,1767.50
"13. Herbert Park Lane, Ballsbridge, Dublin 4 - Apar","Herbert Park Lane, Ballsbridge, Dublin 4",4000, Dublin 4,2,2000.00
"14. The Marker Residence, Grand Canal Dock, Dublin 2 - Apar","The Marker Residence, Grand Canal Dock, Dublin 2",3000, Dublin 2,2,1500.00
"15. 532 The Maple,Beacon South Quarter, Sandyford, Dublin 18 - Apar","532 The Maple,Beacon South Quarter, Sandyford, Dublin 18",2300, Dublin 18,2,1150.00
"16. Levmoss Hall, the Gallops, Leopardstown, Dublin 18 - Apar","Levmoss Hall, the Gallops, Leopardstown, Dublin 18",2250, Dublin 18,2,1125.00
"17. The Grange, Brewery Road, Stillorgan, Co. Dublin - Apar","The Grange, Brewery Road, Stillorgan, Co. Dublin",2400, Co. Dublin,2,1200.00
"18. Clancy Quay by Kennedy Wilson, Dublin 8 - Apar","Clancy Quay by Kennedy Wilson, Dublin 8",1700, Dublin 8,1,1700.00
"19. Vantage by Kennedy Wilson, Central Park, Leopardstown, Dublin 18 - Apar","Vantage by Kennedy Wilson, Central Park, Leopardstown, Dublin 18",2939, Dublin 18,3,979.67
"20. Vantage by Kennedy Wilson, Central Park, Leopardst, Leopardstown, Dublin 18 - Apar","Vantage by Kennedy Wilson, Central Park, Leopardst, Leopardstown, Dublin 18",2300, Dublin 18,2,1150.00
"1. Apartment 2, Garrison, Co. Fermanagh, BT93 4AE - Apa","Apartment 2, Garrison, Co. Fermanagh, BT93 4AE",400456, BT93 4AE,2,200228.00
"1. Sliabh Ard, Bothar Stiofan, Knocknacarra, Co. Galway - Apa","Sliabh Ard, Bothar Stiofan, Knocknacarra, Co. Galway",968, Co. Galway,2,484.00
"2. Edward Square Apartments, Barrack Lane, Galway City, Co. Galway - Apa","Edward Square Apartments, Barrack Lane, Galway City, Co. Galway",988, Co. Galway,3,329.33
"3. Garran Ard, Doughiska, Co. Galway - Apa","Garran Ard, Doughiska, Co. Galway",1300, Co. Galway,3,433.33
"4. Gleann Na Ri, Murrough, Renmore, Renmore, Co. Galway - Apa","Gleann Na Ri, Murrough, Renmore, Renmore, Co. Galway",1065, Co. Galway,2,532.50
"5. Lios Ealtain, Nile Lodge, Galway City, Co. Galway - Apa","Lios Ealtain, Nile Lodge, Galway City, Co. Galway",1500, Co. Galway,3,500.00
"6. Abbey Court, Mary Street, Galway City, Co. Galway - Apa","Abbey Court, Mary Street, Galway City, Co. Galway",1250, Co. Galway,2,625.00
"7. Castle Street, Galway City, Co. Galway - Apa","Castle Street, Galway City, Co. Galway",1300, Co. Galway,2,650.00
"8. 6A Rocklands Ave, Ballybane, Co. Galway - Apa","6A Rocklands Ave, Ballybane, Co. Galway",550, Co. Galway,1,550.00
"9. No. 81 Coill Tire, Doughiska, Co. Galway - Apa","No. 81 Coill Tire, Doughiska, Co. Galway",1800, Co. Galway,2,900.00
"10. 108 Bluebell Woods, Oranmore, Co Galway, Oranmore, Co. Galway - Apar","108 Bluebell Woods, Oranmore, Co Galway, Oranmore, Co. Galway",1100, Co. Galway,2,550.00
"11. No. 12 An Creagan, Barna, Co. Galway - Apar","No. 12 An Creagan, Barna, Co. Galway",1400, Co. Galway,2,700.00
"12. Annaghill, Lackagh, Co. Galway - Apar","Annaghill, Lackagh, Co. Galway",600, Co. Galway,1,600.00
"13. Ce Na Mara, The Docks, Galway City, Co. Galway - Apar","Ce Na Mara, The Docks, Galway City, Co. Galway",1500, Co. Galway,2,750.00
"14. Serviced Apartment, Lough Atalia, Galway City, Co. Galway - Apar","Serviced Apartment, Lough Atalia, Galway City, Co. Galway",2600, Co. Galway,2,1300.00
"15. Sheerwater House, Galway City, Co. Galway - Apar","Sheerwater House, Galway City, Co. Galway",2000, Co. Galway,2,1000.00
"16. An Creagan, Barna, Co. Galway - Apar","An Creagan, Barna, Co. Galway",1350, Co. Galway,2,675.00
"17. Ocean Towers, Blackrock, Salthill, Co. Galway - Apar","Ocean Towers, Blackrock, Salthill, Co. Galway",1600, Co. Galway,2,800.00
"18. LIOS EALTÁN, LOWER SALTHILL, Salthill, Co. Galway - Apar","LIOS EALTÁN, LOWER SALTHILL, Salthill, Co. Galway",1250, Co. Galway,2,625.00
"19. Shannon Oaks St Joesphs Road, Portumna, Co. Galway - Apar","Shannon Oaks St Joesphs Road, Portumna, Co. Galway",700, Co. Galway,2,350.00
"20. Silverseas, Knocknacarra, Co. Galway - Apar","Silverseas, Knocknacarra, Co. Galway",1500, Co. Galway,2,750.00
"1. Tralee Marina, Tralee, Co. Kerry - Apa","Tralee Marina, Tralee, Co. Kerry",825, Co. Kerry,2,412.50
"2. Tralee Marina, Tralee, Co. Kerry - Apa","Tralee Marina, Tralee, Co. Kerry",800, Co. Kerry,2,400.00
"3. The Anchorage, Tralee, Co. Kerry - Apa","The Anchorage, Tralee, Co. Kerry",800, Co. Kerry,2,400.00
"4. An Sean Mhuileann, Tralee, Co. Kerry - Apa","An Sean Mhuileann, Tralee, Co. Kerry",795, Co. Kerry,2,397.50
"5. William Street, Listowel, Co. Kerry - Apa","William Street, Listowel, Co. Kerry",480, Co. Kerry,2,240.00
"6. Market Passage, The Mall, Tralee, Co. Kerry - Apa","Market Passage, The Mall, Tralee, Co. Kerry",650, Co. Kerry,2,325.00
"7. Park Road, Killarney, Co. Kerry - Apa","Park Road, Killarney, Co. Kerry",980, Co. Kerry,2,490.00
"8. Cuirt Cleady, Glanerought, Kenmare, Co. Kerry - Apa","Cuirt Cleady, Glanerought, Kenmare, Co. Kerry",700, Co. Kerry,2,350.00
"9. 12 Grosvenor Court, High Street, Killarney, Co. Kerry - Apa","12 Grosvenor Court, High Street, Killarney, Co. Kerry",850, Co. Kerry,2,425.00
"10. Ref 777 - Apartment, New Street, Cahersiveen, Co. Kerry - Apar","Ref 777 - Apartment, New Street, Cahersiveen, Co. Kerry",600, Co. Kerry,2,300.00
"11. Park Road, Killarney, Co. Kerry - Apar","Park Road, Killarney, Co. Kerry",1050, Co. Kerry,2,525.00
"12. Killarney Road, Castleisland, Co. Kerry - Apar","Killarney Road, Castleisland, Co. Kerry",520, Co. Kerry,2,260.00
"13. Killorglin Town Centre, Killorglin, Co. Kerry - Apar","Killorglin Town Centre, Killorglin, Co. Kerry",700, Co. Kerry,2,350.00
"14. Main Street, Killorglin, Co. Kerry - Apar","Main Street, Killorglin, Co. Kerry",600, Co. Kerry,2,300.00
"15. Apt 1 Scrahan Place, Ross road, Killarney, Co. Kerry - Apar","Apt 1 Scrahan Place, Ross road, Killarney, Co. Kerry",900, Co. Kerry,2,450.00
"16. Main St., Castleisland, Co. Kerry - Apar","Main St., Castleisland, Co. Kerry",500, Co. Kerry,2,250.00
"17. Apartment 4 Town Centre, Killorglin, Co. Kerry - Apar","Apartment 4 Town Centre, Killorglin, Co. Kerry",600, Co. Kerry,1,600.00
"18. Kilbrean, Killarney, Co. Kerry - Apar","Kilbrean, Killarney, Co. Kerry",800, Co. Kerry,2,400.00
"19. New Market Lane, Killarney, Co. Kerry - Apar","New Market Lane, Killarney, Co. Kerry",700, Co. Kerry,2,350.00
"20. Lissivigeen area, Killarney, Co. Kerry - Apar","Lissivigeen area, Killarney, Co. Kerry",700, Co. Kerry,1,700.00
"1. Stradbrook Luxury Appartment, Portlaoise, Co. Laois - Apa","Stradbrook Luxury Appartment, Portlaoise, Co. Laois",875, Co. Laois,2,437.50
"2. De Vesci Court, Portlaoise, Co. Laois - Apa","De Vesci Court, Portlaoise, Co. Laois",800, Co. Laois,1,800.00
"3. De Vesci Court, Fairgreen, Portlaoise, Co. Laois - Apa","De Vesci Court, Fairgreen, Portlaoise, Co. Laois",900, Co. Laois,2,450.00
"4. Church Street, Portlaoise, Co. Laois - Apa","Church Street, Portlaoise, Co. Laois",850, Co. Laois,2,425.00
"5. The Mews, Mountrath Road, Portlaoise, Co. Laois - Apa","The Mews, Mountrath Road, Portlaoise, Co. Laois",750, Co. Laois,1,750.00
"6. Heather Lane, Esker Hills, Portlaoise, Co. Laois - Apa","Heather Lane, Esker Hills, Portlaoise, Co. Laois",900, Co. Laois,2,450.00
"7. Lalor Way Fairgreen Portlaoise, Portlaoise, Co. Laois - Apa","Lalor Way Fairgreen Portlaoise, Portlaoise, Co. Laois",900, Co. Laois,2,450.00
"8. College View, Mountmellick, Co. Laois - Apa","College View, Mountmellick, Co. Laois",850, Co. Laois,2,425.00
"9. The Maples, Forest Park, Portlaoise, Co. Laois - Apa","The Maples, Forest Park, Portlaoise, Co. Laois",850, Co. Laois,2,425.00
"10. Lalor Way, Fairgreen, Portlaoise, Co. Laois - Apar","Lalor Way, Fairgreen, Portlaoise, Co. Laois",900, Co. Laois,2,450.00
"11. 95, Riverside, Portarlington, Co. Laois - Apar","95, Riverside, Portarlington, Co. Laois",800, Co. Laois,2,400.00
"12. Kilnacourt Woods, Portarlington, Co. Laois - Apar","Kilnacourt Woods, Portarlington, Co. Laois",650, Co. Laois,1,650.00
"1. Leitrim Village, Leitrim, Co. Leitrim - Apa","Leitrim Village, Leitrim, Co. Leitrim",700, Co. Leitrim,3,233.33
"2. Bridge Street, Carrick-on-Shannon, Co. Leitrim - Apa","Bridge Street, Carrick-on-Shannon, Co. Leitrim",480, Co. Leitrim,1,480.00
"3. The Pavillion, Carrick-on-Shannon, Co. Leitrim - Apa","The Pavillion, Carrick-on-Shannon, Co. Leitrim",650, Co. Leitrim,3,216.67
"4. Riverview, Carrick-on-Shannon, Co. Leitrim - Apa","Riverview, Carrick-on-Shannon, Co. Leitrim",600, Co. Leitrim,2,300.00
"5. Bridge Street, Carrick-on-Shannon, Co. Leitrim - Apa","Bridge Street, Carrick-on-Shannon, Co. Leitrim",450, Co. Leitrim,1,450.00
"6. No 9, Carbry Coast, Tullaghan, Co, Tullaghan, Co. Leitrim - Apa","No 9, Carbry Coast, Tullaghan, Co, Tullaghan, Co. Leitrim",450, Co. Leitrim,2,225.00
"7. Quay Road, Carrick-on-Shannon, Co. Leitrim - Apa","Quay Road, Carrick-on-Shannon, Co. Leitrim",550, Co. Leitrim,2,275.00
"8. Key Street, Carrick-on-Shannon, Co. Leitrim - Apa","Key Street, Carrick-on-Shannon, Co. Leitrim",475, Co. Leitrim,1,475.00
"9. The Waterfront, Leitrim, Co. Leitrim - Apa","The Waterfront, Leitrim, Co. Leitrim",700, Co. Leitrim,3,233.33
"10. 4 Library Corner, Manorhamilton, Co. Leitrim - Apar","4 Library Corner, Manorhamilton, Co. Leitrim",500, Co. Leitrim,2,250.00
"11. Ayrefield Manor, Carrick-on-Shannon, Co. Leitrim - Apar","Ayrefield Manor, Carrick-on-Shannon, Co. Leitrim",550, Co. Leitrim,2,275.00
"12. Priest Lane, Carrick-on-Shannon, Co. Leitrim - Apar","Priest Lane, Carrick-on-Shannon, Co. Leitrim",600, Co. Leitrim,2,300.00
"1. Newtown Mews, Annacotty, Co. Limerick - Apa","Newtown Mews, Annacotty, Co. Limerick",1400, Co. Limerick,3,466.67
"2. Kildimo, Kildimo, Co. Limerick - Apa","Kildimo, Kildimo, Co. Limerick",1150, Co. Limerick,2,575.00
"3. Apartment 1, Block A, Ballycummin Village, Raheen, Co. Limerick - Apa","Apartment 1, Block A, Ballycummin Village, Raheen, Co. Limerick",1100, Co. Limerick,2,550.00
"4. Banantyne place, Steamboat quay, Dock road, Limerick City, Co. Limerick - Apa","Banantyne place, Steamboat quay, Dock road, Limerick City, Co. Limerick",1400, Co. Limerick,3,466.67
"5. Drominbeg, Rhebogue, Co. Limerick - Apa","Drominbeg, Rhebogue, Co. Limerick",1300, Co. Limerick,3,433.33
"6. Riverpoint, Limerick City, Co. Limerick - Apa","Riverpoint, Limerick City, Co. Limerick",1200, Co. Limerick,2,600.00
"7. Harveys Quay, Limerick City, Co. Limerick - Apa","Harveys Quay, Limerick City, Co. Limerick",1300, Co. Limerick,2,650.00
"8. Penthouse Apartment, Charlotte Quay, Limerick, Limerick City, Co. Limerick - Apa","Penthouse Apartment, Charlotte Quay, Limerick, Limerick City, Co. Limerick",1200, Co. Limerick,2,600.00
"9. Newcastle Court, Castletroy, Co. Limerick - Apa","Newcastle Court, Castletroy, Co. Limerick",1200, Co. Limerick,2,600.00
"10. The Strand, O'Callaghan Strand, Limerick City, Co. Limerick - Apar","The Strand, O'Callaghan Strand, Limerick City, Co. Limerick",1250, Co. Limerick,1,1250.00
"11. Riverpoint, Bishops Quay, Limerick City, Co. Limerick - Apar","Riverpoint, Bishops Quay, Limerick City, Co. Limerick",1400, Co. Limerick,2,700.00
"12. Main Street, Adare, Co. Limerick - Apar","Main Street, Adare, Co. Limerick",1250, Co. Limerick,2,625.00
"13. The Strand, O'Callaghans Strand, Limerick City, Co. Limerick - Apar","The Strand, O'Callaghans Strand, Limerick City, Co. Limerick",1575, Co. Limerick,3,525.00
"14. The Strand, O' Callaghan Strand, Limerick City, Co. Limerick - Apar","The Strand, O' Callaghan Strand, Limerick City, Co. Limerick",1500, Co. Limerick,2,750.00
"15. Main Street, Adare, Co. Limerick - Apar","Main Street, Adare, Co. Limerick",1100, Co. Limerick,2,550.00
"16. An Dun, Church road, Raheen, Co. Limerick - Apar","An Dun, Church road, Raheen, Co. Limerick",1100, Co. Limerick,2,550.00
"17. Bridgewater Court, Limerick City, Co. Limerick - Apar","Bridgewater Court, Limerick City, Co. Limerick",1200, Co. Limerick,2,600.00
"18. Coolbane, Castleconnell, Co. Limerick - Apar","Coolbane, Castleconnell, Co. Limerick",950, Co. Limerick,3,316.67
"19. Oakdale Court, Ennis Road, Co. Limerick - Apar","Oakdale Court, Ennis Road, Co. Limerick",850, Co. Limerick,1,850.00
"20. Palmerstown Court, Limerick City, Co. Limerick - Apar","Palmerstown Court, Limerick City, Co. Limerick",1200, Co. Limerick,3,400.00
"1. Main Street, Granard, Co. Longford - Apa","Main Street, Granard, Co. Longford",400, Co. Longford,1,400.00
"2. Sandy Lane, Richmond Street Longford, Longford Town, Co. Longford - Apa","Sandy Lane, Richmond Street Longford, Longford Town, Co. Longford",575, Co. Longford,1,575.00
"3. Sli Na Mona, Ballymahon, Co. Longford - Apa","Sli Na Mona, Ballymahon, Co. Longford",520, Co. Longford,1,520.00
"4. Cornmill House, Great Water Street, Longford Town, Co. Longford - Apa","Cornmill House, Great Water Street, Longford Town, Co. Longford",450, Co. Longford,1,450.00
"5. The Granary, Ballymahon, Co. Longford - Apa","The Granary, Ballymahon, Co. Longford",650, Co. Longford,2,325.00
"6. Creevaghbawn, Creevaghbeg, Mullingar Road, Ballymahon, Co. Longford - Apa","Creevaghbawn, Creevaghbeg, Mullingar Road, Ballymahon, Co. Longford",520, Co. Longford,1,520.00
"7. The Mill, Clondra, Clondra, Co. Longford - Apa","The Mill, Clondra, Clondra, Co. Longford",650, Co. Longford,3,216.67
"8. Drumlish Road. Longford Town, Longford Town, Co. Longford - Apa","Drumlish Road. Longford Town, Longford Town, Co. Longford",600, Co. Longford,1,600.00
"9. French Hall,Prospect Wood, Longford Town, Co. Longford - Apa","French Hall,Prospect Wood, Longford Town, Co. Longford",600, Co. Longford,2,300.00
"10. APT 2, Main street, Ballymahon, Co. Longford - Apar","APT 2, Main street, Ballymahon, Co. Longford",650, Co. Longford,2,325.00
"11. 10 Edgeworth Hall,Prospect Wood, Longford Town, Co. Longford - Apar","10 Edgeworth Hall,Prospect Wood, Longford Town, Co. Longford",600, Co. Longford,2,300.00
"12. 14,The Mill, Clondra, Co. Longford - Apar","14,The Mill, Clondra, Co. Longford",600, Co. Longford,3,200.00
"13. Main Street, Granard, Co. Longford - Apar","Main Street, Granard, Co. Longford",400, Co. Longford,1,400.00
"14. Main Street, Granard, Co. Longford - Apar","Main Street, Granard, Co. Longford",400, Co. Longford,1,400.00
"15. Prucklish, Newtownforbes, Co. Longford - Apar","Prucklish, Newtownforbes, Co. Longford",500, Co. Longford,1,500.00
"16. Main St., Ballymahon, Co. Longford - Apar","Main St., Ballymahon, Co. Longford",600, Co. Longford,2,300.00
"17. Edgeworth Hall, Longford Town, Co. Longford - Apar","Edgeworth Hall, Longford Town, Co. Longford",550, Co. Longford,2,275.00
"18. 13 Harbour Point, Longford Town, Co. Longford - Apar","13 Harbour Point, Longford Town, Co. Longford",650, Co. Longford,2,325.00
"1. Drogheda, Drogheda, Co. Louth - Apa","Drogheda, Drogheda, Co. Louth",1150, Co. Louth,1,1150.00
