9,"Kilduff, Pallasgreen, Co. Limerick",650, Co. Limerick,2 ,325.00
10,"Abbey court, Raheen, Co. Limerick",1400, Co. Limerick,4 ,350.00
11,"36 Ashfort, Castletroy, Co. Limerick",1300, Co. Limerick,3 ,433.33
12,"Sli Na Manach, Mungret, Co. Limerick",1800, Co. Limerick,3 ,600.00
13,"Castlerock, Castleconnell, Co. Limerick",1000, Co. Limerick,3 ,333.33
14,"Asgard, North Circular Road, Co. Limerick",2500, Co. Limerick,4 ,625.00
15,"Ashbrook Grove, Ennis Road, Co. Limerick",1600, Co. Limerick,4 ,400.00
16,"Larch Close, Bloomfield, Castletroy, Co. Limerick",1800, Co. Limerick,4 ,450.00
17,"Oakfield, Raheen, Co. Limerick",1400, Co. Limerick,3 ,466.67
18,"Cul Crannagh, Dooradoyle, Co. Limerick",1700, Co. Limerick,4 ,425.00
19,"Jackson Turret, Clancy Strand, Limerick City, Co. Limerick",2200, Co. Limerick,3 ,733.33
20,"Annagh, Lisnagry, Co. Limerick",850, Co. Limerick,2,425.00
21,"Bloomfield, Annacotty, Co. Limerick",1400, Co. Limerick,3 ,466.67
22,"Dromroe, Rhebogue, Co. Limerick",1200, Co. Limerick,3 ,400.00
23,"Killarney Road, Abbeyfeale, Co. Limerick",650, Co. Limerick,4,162.50
24,"Knocknaboula, Foynes, Co. Limerick",800, Co. Limerick,4,200.00
25,"Kilderry, Crecora, Co. Limerick",1200, Co. Limerick,4 ,300.00
26,"Glanntan, Castletroy, Co. Limerick",1550, Co. Limerick,3 ,516.67
27,"4 Avignon, Milford Grange, Castletroy, Co. Limerick",464, Co. Limerick,1,464.00
28,"Templeville, Punches Close, Ballinacurra, Co. Limerick",2000, Co. Limerick,5 ,400.00
29,"Willow Crescent, Annacotty, Co. Limerick",1500, Co. Limerick,4 ,375.00
30,"Ashbrook, Ennis Road, Limerick City, Co. Limerick",1500, Co. Limerick,4 ,375.00
31,"39 Elm Road, Annacotty, Co. Limerick",1500, Co. Limerick,4 ,375.00
32,"55 Elm Road Riverbank Anacotty, Annacotty, Co. Limerick",1300, Co. Limerick,4 ,325.00
33,"Fitzhaven Square, South Circular Road, Co. Limerick",480, Co. Limerick,4 ,120.00
34,"Avignon, Milford Grange, Castletroy, Co. Limerick",400, Co. Limerick,6 ,66.67
35,"Mount Green, Castletroy, Co. Limerick",1250, Co. Limerick,4 ,312.50
36,"Rower More, Adare, Co. Limerick",1000, Co. Limerick,3,333.33
37,"No 127 Ard na Gruadan, Castletroy, Co. Limerick",335, Co. Limerick,6 ,55.83
38,"Avondale Drive, Greystones, Ennis Road, Co. Limerick",1100, Co. Limerick,3,366.67
39,"Heron Court, North Circular Road, Co. Limerick",1400, Co. Limerick,4 ,350.00
40,"Main Street, Ballylanders, Co. Limerick",750, Co. Limerick,3 ,250.00
41,"Cluain Arra, Newcastle West, Co. Limerick",800, Co. Limerick,3 ,266.67
42,"Mortgage, Meanus, Co. Limerick",1150, Co. Limerick,2 ,575.00
43,"Lord Edward Street, Kilmallock, Co. Limerick",700, Co. Limerick,3 ,233.33
44,"6 the village, Adare, Co. Limerick",1900, Co. Limerick,3 ,633.33
45,"Cluain Arra, Newcastle West, Co. Limerick",800, Co. Limerick,3 ,266.67
46,"Cahara, Glin, Co. Limerick",750, Co. Limerick,2 ,375.00
47,"Cois Luacra, Dooradoyle, Co. Limerick",1400, Co. Limerick,4 ,350.00
48,"Brookhaven Walk, Mill Road, Corbally, Co. Limerick",1500, Co. Limerick,4 ,375.00
49,"Church rd, Croom, Co. Limerick",1200, Co. Limerick,2 ,600.00
50,"7 Knocklyon, Clonmacken, Co. Limerick",1200, Co. Limerick,3 ,400.00
51,"2 Church street, Glin, Co. Limerick",670, Co. Limerick,2 ,335.00
52,"Gormanstown, Kilmallock, Co. Limerick",800, Co. Limerick,5 ,160.00
53,"Glenview Gardens, Farranshone, Co. Limerick",1200, Co. Limerick,4,300.00
54,"23,The Cresent, Kilteragh, Dooradoyle, Co. Limerick",1300, Co. Limerick,3 ,433.33
55,"Elm Vale, Riverbank, Annacotty, Co. Limerick",1100, Co. Limerick,3 ,366.67
56,"Main Street, Foynes, Co. Limerick",750, Co. Limerick,3 ,250.00
1,"Harbour Road Tarmon Harbour Tarmonbarry Village, Tarmonbarry, Co. Longford",900, Co. Longford,4 ,225.00
2,"Ballintampan,Curry, Longford Town, Co. Longford",650, Co. Longford,2,325.00
3,"90 Shannon Park, Edgeworthstown, Co. Longford",1000, Co. Longford,4 ,250.00
4,"26 Silver Birches , Stonepark, Danesfort, Co. Longford",700, Co. Longford,3 ,233.33
5,"Forgney Ballymahon, Ballymahon, Co. Longford",1200, Co. Longford,4,300.00
6,"11 Knock CASA DE MARIA, Lanesborough, Co. Longford",360, Co. Longford,1,360.00
7,"Ard Michael, Ballinalee Road, Longford Town, Co. Longford",750, Co. Longford,3 ,250.00
8,"Cloonagh, Dring, Co. Longford",600, Co. Longford,3,200.00
9,"Auburn Park, Edgeworthstown, Co. Longford",600, Co. Longford,3 ,200.00
10,"Newcastle Court, CLUAIN RI, Ballymahon, Co. Longford",850, Co. Longford,4 ,212.50
11,"Cluain Caonach, Keenagh, Co. Longford",750, Co. Longford,4 ,187.50
12,"Ballywillan, Granard, Co. Longford",650, Co. Longford,4,162.50
13,"The Green, Lanesborough, Lanesborough, Co. Longford",675, Co. Longford,4 ,168.75
14,"Clonbalt Woods, Longford Town, Co. Longford",850, Co. Longford,4 ,212.50
15,"14, Harbor view, Tarmonbarry, Co. Longford",800, Co. Longford,4 ,200.00
16,"42,Clough Dillon, Keenagh, Co. Longford",750, Co. Longford,4 ,187.50
17,"Aughadegnan, Longford Town, Co. Longford",900, Co. Longford,3,300.00
18,"Barnacor, Lanesborough, Co. Longford",750, Co. Longford,4,187.50
19,"Tullyvrane, Lanesborough, Co. Longford",600, Co. Longford,3 ,200.00
20,"14 Cluain Dara, Lanesborough, Co. Longford",700, Co. Longford,3 ,233.33
21,"Sycamore Close, Clonbalt Woods, Longford Town, Co. Longford",900, Co. Longford,4 ,225.00
22,"Forthill, Aughnacliffe, Co. Longford",750, Co. Longford,3 ,250.00
23,"Cornageelagh, Newtowncashel, Co. Longford",600, Co. Longford,3,200.00
24,"Cnoc Na Gaoithe, Lanesborough, Co. Longford",3000, Co. Longford,3 ,1000.00
25,"Cahannagh, Longford Town, Co. Longford",750, Co. Longford,4,187.50
26,"1 Esker Glen, Drumlish, Co. Longford",775, Co. Longford,4 ,193.75
1,"106 Bryanstown Manor, Bryanstown, Drogheda, Co. Louth",1500, Co. Louth,3 ,500.00
2,"Old Golf Links Road, Blackrock, Co. Louth",1300, Co. Louth,3 ,433.33
3,"23 Windmill Court, Dundalk, Co. Louth",1050, Co. Louth,2,525.00
4,"Broughton Street, Dundalk, Co. Louth",1000, Co. Louth,3,333.33
5,"Gosling Terrace, Dundalk, Co. Louth",850, Co. Louth,2,425.00
6,"Oyster Bay, Carlingford, Co. Louth",950, Co. Louth,3 ,316.67
7,"Annaverna, Ravensdale, Co. Louth",1100, Co. Louth,5 ,220.00
8,"Togher, Drogheda, Co. Louth",1200, Co. Louth,3,400.00
9,"Duddestown, Togher, Co. Louth",1200, Co. Louth,3,400.00
10,"36 Colpe View, Deepforde, Dublin Road, Drogheda, Co. Louth",1600, Co. Louth,3 ,533.33
11,"Blackhall, Sunhill, Termonfeckin, Co. Louth",1250, Co. Louth,4 ,312.50
12,"Canonstown, Termonfeckin, Co. Louth",1500, Co. Louth,3,500.00
13,"Clogher Cove, Clogherhead, Co. Louth",1500, Co. Louth,5 ,300.00
14,"tallanstown manor, Tallanstown, Co. Louth",1200, Co. Louth,4 ,300.00
15,"Bachelors Walk, Dundalk, Co. Louth",1050, Co. Louth,2,525.00
16,"6 Cuchilainn Terrace, Dundalk, Co. Louth",900, Co. Louth,3 ,300.00
17,"28 Riverside Drive, Dundalk, Co. Louth",1200, Co. Louth,3 ,400.00
18,"5 Priory Villas, Dundalk, Co. Louth",1700, Co. Louth,2 ,850.00
19,"Lisheen Pk, Knockbridge, Co. Louth",1100, Co. Louth,3,366.67
20,"Charlestown, Ardee, Co. Louth",780, Co. Louth,2,390.00
21,"Mellifont Court, Collon, Co. Louth",1250, Co. Louth,3 ,416.67
22,"The cottage, Blackrock, Co. Louth",900, Co. Louth,3,300.00
23,"Wyanstown, Togher, Co. Louth",1250, Co. Louth,4 ,312.50
24,"Oldbridge, Mell, Drogheda, Co. Louth",1600, Co. Louth,4 ,400.00
25,"Culhane Street, Dundalk, Co. Louth",1200, Co. Louth,4,300.00
26,"Sea View, Annagassan, Co. Louth",1000, Co. Louth,3,333.33
27,"Silk Park, Drogheda, Co. Louth",1500, Co. Louth,3 ,500.00
28,"Langfield, Dublin Road, Dundalk, Co. Louth",1300, Co. Louth,3 ,433.33
29,"Kingswood, Rock Road, Dundalk, Co. Louth",1500, Co. Louth,5 ,300.00
30,"The Garden House, Barmeath Castle, Dunleer, Co. Louth",1500, Co. Louth,6 ,250.00
31,"38 Seatown, Dundalk, Co. Louth",1200, Co. Louth,4 ,300.00
32,"Castle Hill, Carlingford, Co. Louth",1000, Co. Louth,3,333.33
33,"8 Harbour View, Carlingford, Co. Louth",1200, Co. Louth,3 ,400.00
34,"20 Clos Aodhan, Saltown, Dundalk, Co. Louth",1200, Co. Louth,3 ,400.00
35,"Bellingham Heights, Castlebellingham, Co. Louth",1200, Co. Louth,4 ,300.00
36,"The Malthouse, Castlebellingham, Co. Louth",900, Co. Louth,3 ,300.00
37,"85 Doolargy, Dundalk, Co. Louth",1200, Co. Louth,3,400.00
38,"Beechwood drive, Termon Abbey, Drogheda, Co. Louth",1350, Co. Louth,4,337.50
39,"105 Oriel Cove, Clogherhead, Co. Louth",1400, Co. Louth,3 ,466.67
40,"Euston Street, Greenore, Co. Louth",1000, Co. Louth,3 ,333.33
41,"Clermont Manor, Blackrock, Co. Louth",1400, Co. Louth,4 ,350.00
42,"83 Bridge St, Dundalk, Co. Louth",850, Co. Louth,2,425.00
43,"Laurel Brook Gardens, Dundalk, Co. Louth",1200, Co. Louth,3 ,400.00
44,"Greenwood Drive, Red Barns Rd, Dundalk, Co. Louth",1500, Co. Louth,4 ,375.00
45,"Village Lodge Greenore Rd, Carlingford, Co. Louth",4000, Co. Louth,5 ,800.00
46,"Cuchulainn Heights, Carlingford, Co. Louth",1200, Co. Louth,3 ,400.00
47,"Belfry Drive, Dundalk, Co. Louth",1300, Co. Louth,4 ,325.00
48,"3 Mount View, Hale Street, Ardee, Co. Louth",1250, Co. Louth,3 ,416.67
49,"Pearse Park, Dundalk, Co. Louth",1200, Co. Louth,3,400.00
50,"N1, Kilcurry, Co. Louth",1495, Co. Louth,5 ,299.00
51,"Martello Village, Drogheda, Co. Louth",1450, Co. Louth,3 ,483.33
52,"Oaklawns, Drogheda, Co. Louth",1200, Co. Louth,3,400.00
53,"Glenwood est Dublin rd, Dundalk, Co. Louth",1200, Co. Louth,3,400.00
54,"newry street, Carlingford, Co. Louth",1200, Co. Louth,3,400.00
55,"Colpe Avenue, Deepforde, Drogheda, Co. Louth",1612, Co. Louth,4 ,403.00
56,"Armagh road dundalk, Dundalk, Co. Louth",1250, Co. Louth,4 ,312.50
57,"The Gables, Mount Avenue, Dundalk, Co. Louth",2500, Co. Louth,4 ,625.00
58,"boynehall, old slane road, Drogheda, Co. Louth",1500, Co. Louth,4 ,375.00
59,"Edentubber, Ravensdale, Dundalk, Co. Louth",850, Co. Louth,3 ,283.33
60,"Ard Shee, Blackrock, Co. Louth",1400, Co. Louth,4 ,350.00
1,"Aughagower Westport, Aghagower, Co. Mayo",800, Co. Mayo,3 ,266.67
2,"Swinford Road, Foxford, Co. Mayo",550, Co. Mayo,2,275.00
3,"Ballyglass, Claremorris, Co. Mayo",750, Co. Mayo,4 ,187.50
4,"Manor Village, Castlebar, Co. Mayo",730, Co. Mayo,3 ,243.33
5,"Pound Lane, Swinford, Co. Mayo",660, Co. Mayo,3 ,220.00
6,"Bowgate Street, Ballinrobe, Co. Mayo",600, Co. Mayo,2,300.00
7,"Rosmoney, Westport, Co. Mayo",3750, Co. Mayo,5 ,750.00
8,"BLACKROCK COURT, Ballina, Co. Mayo",850, Co. Mayo,4 ,212.50
9,"Carrabeg, Castlebar, Co. Mayo",900, Co. Mayo,3 ,300.00
10,"Rossmore, Castlebar, Co. Mayo",850, Co. Mayo,3 ,283.33
11,"Aglish, Castlebar, Co. Mayo",800, Co. Mayo,3,266.67
12,"Castlehill Park, Castlebar, Co. Mayo",800, Co. Mayo,3,266.67
13,"Glencarra, Knock, Co. Mayo",550, Co. Mayo,2 ,275.00
14,"Aughness, Ballycroy, Co. Mayo",700, Co. Mayo,5 ,140.00
15,"Aughness, Ballycroy, Co. Mayo",550, Co. Mayo,3 ,183.33
16,"The Fairways, Castlebar, Co. Mayo",520, Co. Mayo,1,520.00
17,"Bridge Street, Kilkelly, Co. Mayo",550, Co. Mayo,3,183.33
18,"Airport Road, Charlestown, Co. Mayo",650, Co. Mayo,3 ,216.67
19,"Ballaghaderren Road, Kilkelly, Co. Mayo",560, Co. Mayo,3,186.67
20,"Old Court Yard, Killala, Co. Mayo",520, Co. Mayo,2,260.00
21,"Gortmore, Tourmakeady, Co. Mayo",850, Co. Mayo,4 ,212.50
22,"Lackafinna, Cong, Co. Mayo",750, Co. Mayo,4 ,187.50
23,"Curneen, Murneen, Kiltimagh, Co. Mayo",900, Co. Mayo,2,450.00
24,"Rosbeg, Westport, Co. Mayo",1000, Co. Mayo,3,333.33
25,"1 riverbank close newtown partry mayo, Partry, Co. Mayo",750, Co. Mayo,4 ,187.50
26,"Belclare, Westport, Co. Mayo",3250, Co. Mayo,4 ,812.50
27,"Ashford, Dringeen, Cong, Co. Mayo",750, Co. Mayo,4 ,187.50
28,"23 Quay Village, Westport, Co. Mayo",825, Co. Mayo,2 ,412.50
29,"Killadoon, Westport, Co. Mayo",700, Co. Mayo,2,350.00
30,"Killala Road Oaklawns, Ballina, Co. Mayo",740, Co. Mayo,4 ,185.00
31,"College View, Westport Road, Castlebar, Co. Mayo",950, Co. Mayo,3 ,316.67
32,"Frenchill, Castlebar, Co. Mayo",800, Co. Mayo,3,266.67
33,"1 The Lodge, Murrisk na bol, Murrisk, Westport, Murrisk, Co. Mayo",800, Co. Mayo,2,400.00
34,"9 Westbury Court' Quay Road, Westport, Co. Mayo",1100, Co. Mayo,3 ,366.67
35,"Shraigh Hill, Belmullet, Co. Mayo",500, Co. Mayo,3,166.67
36,"16 College Green, Claremorris, Co. Mayo",950, Co. Mayo,5 ,190.00
37,"An Sean Bhaile, Bellaghy, Charlestown, Co. Mayo",575, Co. Mayo,3 ,191.67
38,"Oakwood, Bohola, Co. Mayo",850, Co. Mayo,4 ,212.50
39,"Ballyneggin, Castlebar, Co. Mayo",900, Co. Mayo,4 ,225.00
40,"Manulla Cottage, Castlebar, Co. Mayo",750, Co. Mayo,3,250.00
41,"Carrowmore, Manulla, Co. Mayo",800, Co. Mayo,4 ,200.00
42,"Summerfield, Castlebar, Co. Mayo",900, Co. Mayo,4 ,225.00
43,"Airport Rd, Charlestown, Co. Mayo",600, Co. Mayo,3 ,200.00
44,"Knockaphunta Park, Castlebar, Co. Mayo",850, Co. Mayo,3 ,283.33
45,"Sarsfield Manor, Charlestown, Co. Mayo",650, Co. Mayo,4,162.50
46,"Ballyneggin, Castlebar, Co. Mayo",900, Co. Mayo,4 ,225.00
47,"Sion Hill, Castlebar, Co. Mayo",875, Co. Mayo,4 ,218.75
48,"An Sean Bhaile, Bellaghy, Charlestown, Co. Mayo",575, Co. Mayo,3 ,191.67
49,"Oaksview, Turlough Rd, Castlebar, Co. Mayo",850, Co. Mayo,4 ,212.50
50,"Springfield Court, Castlebar, Co. Mayo",650, Co. Mayo,2,325.00
51,"Whitehorse Lane, Castlebar, Co. Mayo",850, Co. Mayo,4 ,212.50
52,"Moneen Road, Castlebar, Co. Mayo",900, Co. Mayo,3 ,300.00
53,"Cashel, Foxford, Co. Mayo",1000, Co. Mayo,6,166.67
54,"Riverside Drive, Ballina, Co. Mayo",700, Co. Mayo,4 ,175.00
55,"Castle Road, Ballina, Co. Mayo",725, Co. Mayo,3,241.67
56,"Belgarrow, Foxford, Co. Mayo",825, Co. Mayo,3 ,275.00
57,"Glencastle, Bunnahowen, Co. Mayo",450, Co. Mayo,2,225.00
58,"Massbrook South, Bofeenaun, Pontoon, Co. Mayo",800, Co. Mayo,3 ,266.67
59,"9 The Shores, Annagh Village, Laherdane, Lahardaun, Co. Mayo",575, Co. Mayo,3 ,191.67
60,"Peter St, Westport, Co. Mayo",1200, Co. Mayo,3 ,400.00
61,"Aillemore, Killadoon, Louisburgh, Co. Mayo",480, Co. Mayo,2,240.00
62,"Westlands, Westport, Co. Mayo",1000, Co. Mayo,4 ,250.00
63,"Murrisk, Westport, Murrisk, Co. Mayo",715, Co. Mayo,3 ,238.33
64,"Knappaghbeg, Westport, Co. Mayo",700, Co. Mayo,3,233.33
65,"Killawalla, Westport, Co. Mayo",900, Co. Mayo,5 ,180.00
66,"Barleyhill, Westport, Co. Mayo",1100, Co. Mayo,3 ,366.67
67,"39 Ashford Court, Claremorris, Co. Mayo",800, Co. Mayo,4 ,200.00
68,"Rahard, Ballinrobe, Co. Mayo",700, Co. Mayo,4 ,175.00
69,"Coolcun, Scardaun, Co. Mayo",600, Co. Mayo,3,200.00
1,"Pike Corner, Kilmessan, Co. Meath",2200, Co. Meath,5 ,440.00
2,"Corballis, Donore, Drogheda, Co. Meath, Donore, Co. Meath",1465, Co. Meath,4 ,366.25
3,"Dunville Lawn, Athlumney, Co. Meath",1650, Co. Meath,3 ,550.00
4,"11 Grand Priory, Kells, Co. Meath",1650, Co. Meath,4 ,412.50
5,"Newmans Mill, Athboy, Co. Meath",1100, Co. Meath,4 ,275.00
6,"5 tara place, Ashbourne, Co. Meath",1250, Co. Meath,2,625.00
7,"Rathkenny, Navan, Co. Meath, Rathkenny, Co. Meath",900, Co. Meath,3 ,300.00
8,"Ross, Mountnugent, Oldcastle, Co. Meath",700, Co. Meath,3,233.33
9,"Boynagh cl, Kilmainhamwood, Co. Meath",1200, Co. Meath,3,400.00
10,"Ballygortha, Summerhill, Co. Meath",1500, Co. Meath,3 ,500.00
11,"Ledwidge Hall, Slane, Co. Meath",1750, Co. Meath,4 ,437.50
12,"Newcastle Wood Square, Enfield, Co. Meath",1400, Co. Meath,3 ,466.67
13,"64 Racehill Park, Ashbourne, Co. Meath",3000, Co. Meath,5 ,600.00
14,"The Back Lodge, French Lane, Stackallen, Co. Meath",2500, Co. Meath,4 ,625.00
15,"13 Crannog Dunshaughlin Co. Meath, Dunshaughlin, Co. Meath",1486, Co. Meath,4 ,371.50
16,"Ballygortagh, Summerhill, Co. Meath",1600, Co. Meath,4,400.00
17,"The Commons, Duleek, Co. Meath",1400, Co. Meath,3 ,466.67
18,"Coolfore, Ashbourne, Co. Meath",2300, Co. Meath,5 ,460.00
19,"Oakleigh, Balreask Old, Navan, Co. Meath",1500, Co. Meath,4 ,375.00
20,"Town Centre, Kells, Co. Meath",1300, Co. Meath,3 ,433.33
21,"Cloona Paddocks, Johnstownbridge, Enfield, Co. Meath",1800, Co. Meath,5 ,360.00
22,"Mornington Park, Mornington, Co. Meath",1300, Co. Meath,3 ,433.33
23,"Cairn Court, Ratoath, Co. Meath",1750, Co. Meath,3 ,583.33
24,"No 4 Circular Road, Kells, Co. Meath",1050, Co. Meath,3,350.00
25,"Tullyard, Trim, Co. Meath",2500, Co. Meath,6 ,416.67
26,"Glen Abhainn Grove, Enfield, Co. Meath",1400, Co. Meath,3 ,466.67
27,"Bective Lodge, Kilmessan, Co. Meath",1190, Co. Meath,3 ,396.67
28,"The Glebe Batterstown, Batterstown, Co. Meath",3000, Co. Meath,5 ,600.00
29,"The Meadows, Dunshaughlin, Co. Meath",1850, Co. Meath,4 ,462.50
30,"51 The Belfry, Athboy Road, Trim, Co. Meath",1400, Co. Meath,3 ,466.67
31,"The Moy, Summerhill, Co. Meath",1200, Co. Meath,2,600.00
32,"Johnstown, Navan, Co. Meath",1250, Co. Meath,3 ,416.67
33,"College Hill, Braystown, Slane, Co. Meath",1800, Co. Meath,5 ,360.00
34,"Horistown, Rathkenny, Co. Meath",1900, Co. Meath,4 ,475.00
35,"Brownstown, Kentstown, Navan, Co. Meath",1450, Co. Meath,2,725.00
36,"The Cairns, Crossakiel, Kells, Co. Meath",1100, Co. Meath,3 ,366.67
37,"The Square, Innwood, Enfield, Co. Meath",1600, Co. Meath,3 ,533.33
38,"Castle Glen, Donacarney, Co. Meath",1000, Co. Meath,2,500.00
39,"41 Cloran Court, Athboy, Athboy, Co. Meath",1300, Co. Meath,3 ,433.33
40,"oldbridge, Drogheda, Co. Meath",1300, Co. Meath,3,433.33
41,"69 Hamilton Place, Trim, Co. Meath",1700, Co. Meath,4 ,425.00
42,"Balgeeth, Ardcath, Co. Meath",1500, Co. Meath,3 ,500.00
43,"Castlejordan Village, Castlejordan, Co. Meath",950, Co. Meath,3,316.67
44,"Vesington Wood, Dunboyne, Co Meath, Dunboyne, Co. Meath",3000, Co. Meath,6 ,500.00
45,"20 Bective Walk, Bective Lodge, Kilmessan, Co. Meath",1350, Co. Meath,3 ,450.00
46,"Cullen, Slane, Co. Meath",2500, Co. Meath,2,1250.00
47,"Ballymadun, Ashbourne, Co. Meath",1800, Co. Meath,3,600.00
1,"12 Lochmor Avenue, Ballybay, Co. Monaghan",650, Co. Monaghan,3,216.67
2,"Castleross Carrickmacross Co Monaghan, Carrickmacross, Co. Monaghan",650, Co. Monaghan,2,325.00
3,"Cornahoe, Castleshane, Co. Monaghan",800, Co. Monaghan,3,266.67
4,"Cabragh, Castleblayney, Co. Monaghan",650, Co. Monaghan,3,216.67
5,"5 Upper York Street, Castleblayney, Co. Monaghan",600, Co. Monaghan,2,300.00
6,"47 Crescent Hill, Castleblayney, Co. Monaghan",900, Co. Monaghan,4 ,225.00
7,"20 Culbrennan, Ballybay, Co. Monaghan",700, Co. Monaghan,4,175.00
8,"26 Rosevale, Castleblayney, Co. Monaghan",850, Co. Monaghan,3,283.33
9,"10 The Crescent, Castleblayney, Co. Monaghan",850, Co. Monaghan,3 ,283.33
10,"Lough Na Glack, Carrickmacross, Co. Monaghan",880, Co. Monaghan,3 ,293.33
11,"Castleblaney Road, Carrickmacross, Co. Monaghan",900, Co. Monaghan,3 ,300.00
12,"Bryanlitter, Clontibret, Co. Monaghan",1000, Co. Monaghan,4 ,250.00
13,"Aughnaseda, Monaghan, Co. Monaghan",700, Co. Monaghan,3 ,233.33
14,"Conabury Close, Castleblayney, Co. Monaghan",700, Co. Monaghan,2,350.00
1,"Ferbane Town, Ferbane, Co. Offaly",800, Co. Offaly,4,200.00
2,"Jail Lawn, Tullamore, Co. Offaly",800, Co. Offaly,3,266.67
3,"Clonminch Wood, Tullamore, Co. Offaly",1000, Co. Offaly,4 ,250.00
4,"Grand Canal Court, Tullamore, Co. Offaly",950, Co. Offaly,3 ,316.67
5,"Durrow, Tullamore, Co. Offaly",1100, Co. Offaly,4,275.00
6,"Ballylin, Ferbane, Co. Offaly",900, Co. Offaly,4 ,225.00
7,"No 7 Chancery Park Way, Chancery Park, Tullamore, Co. Offaly",950, Co. Offaly,3 ,316.67
8,"The Oaks, Hillside, Birr, Co. Offaly",1200, Co. Offaly,4 ,300.00
9,"Church Hill, Tullamore, Co. Offaly",1000, Co. Offaly,4 ,250.00
10,"Carraig cluin, Tullamore, Co. Offaly",950, Co. Offaly,3 ,316.67
11,"Ballin Ri, Tullamore, Co. Offaly",1000, Co. Offaly,3 ,333.33
12,"Harbour Walk, Tullamore, Co. Offaly, Tullamore, Co. Offaly",1000, Co. Offaly,3 ,333.33
13,"Carrig, Birr, Co. Offaly",600, Co. Offaly,2,300.00
14,"Spollanstown Woods, Tullamore, Co. Offaly",1200, Co. Offaly,4 ,300.00
15,"Ballinamona, Durrow, Tullamore, Co. Offaly",1200, Co. Offaly,6 ,200.00
16,"44 Hophill Grove, Tullamore, Co. Offaly",700, Co. Offaly,3,233.33
17,"Charleville Road, Tullamore, Co. Offaly",1000, Co. Offaly,3,333.33
18,"Heather Grove, Clara, Co. Offaly",900, Co. Offaly,3 ,300.00
19,"Bellhill, Clareen, Co. Offaly",600, Co. Offaly,3,200.00
1,"Kielty, Athlone, Co. Roscommon",750, Co. Roscommon,2,375.00
2,"Riverwalk, Rooskey, Co. Roscommon",600, Co. Roscommon,3 ,200.00
3,"Rathcroghan Tulsk, Tulsk, Co. Roscommon",450, Co. Roscommon,3 ,150.00
4,"The Old Mill, Castlerea, Co. Roscommon",650, Co. Roscommon,3 ,216.67
5,"Croghan, Croghan, Co. Roscommon",650, Co. Roscommon,3,216.67
6,"Between Frechpark and Ballaghaderreen, Tibohine, Co. Roscommon",440, Co. Roscommon,1,440.00
7,"Creevyquin Roscommon, Roscommon Town, Co. Roscommon",900, Co. Roscommon,3 ,300.00
8,"8 Castlehall Park, Bealnamulla, Athlone, Co. Roscommon",1100, Co. Roscommon,3 ,366.67
9,"Stonepark, Galway Road, Roscommon Town, Co. Roscommon",950, Co. Roscommon,3,316.67
10,"Cremully, Castlecoote, Co. Roscommon",900, Co. Roscommon,4 ,225.00
11,"Carrownderry, Kiltoom, Athlone, Co. Roscommon",1200, Co. Roscommon,5 ,240.00
12,"4 Sli an Chaoiste, Athlone, Co. Roscommon",1000, Co. Roscommon,3 ,333.33
13,"Claremont Ballyforan, Ballyforan, Co. Roscommon",785, Co. Roscommon,4 ,196.25
14,"Waterville Bealnamulla, Athlone, Co. Roscommon",1400, Co. Roscommon,4 ,350.00
15,"Ardmullen, Athlone, Co. Roscommon",1000, Co. Roscommon,4 ,250.00
16,"Knockcroghery, Knockcroghery, Co. Roscommon",480, Co. Roscommon,1,480.00
17,"Foxfield, Ballaghaderreen, Co. Roscommon",500, Co. Roscommon,5 ,100.00
18,"Ballinlough, Ballinlough, Co. Roscommon",700, Co. Roscommon,4 ,175.00
19,"Clooneyourish, Athleague, Co. Roscommon",750, Co. Roscommon,4 ,187.50
20,"Cregga Court, Elphin, Co. Roscommon",550, Co. Roscommon,3 ,183.33
21,"Drumsillagh, Cootehall, Co. Roscommon",480, Co. Roscommon,3,160.00
22,"Callow, Frenchpark, Co. Roscommon",500, Co. Roscommon,3,166.67
23,"Kye, Elphin, Co. Roscommon",700, Co. Roscommon,4 ,175.00
24,"Woodlands Loughglynn, Castlerea, Co. Roscommon",600, Co. Roscommon,3 ,200.00
25,"27,Waters Edge, Ballyleague, Co. Roscommon",600, Co. Roscommon,2,300.00
26,"15 Meadow Vale, Boyle, Co. Roscommon",675, Co. Roscommon,3 ,225.00
27,"11 Wallace Court, Ballinlough, Co. Roscommon",500, Co. Roscommon,3,166.67
28,"7 Shannon Side, Ballyleague, Co. Roscommon",700, Co. Roscommon,3,233.33
29,"6 Warren Drive, Boyle, Co. Roscommon",850, Co. Roscommon,5 ,170.00
30,"Quay West, Cootehall, Co. Roscommon",700, Co. Roscommon,3 ,233.33
31,"Rooskey, Rooskey, Co. Roscommon",750, Co. Roscommon,4 ,187.50
32,"Main Street, Rooskey, Co. Roscommon",750, Co. Roscommon,5 ,150.00
33,"Keadue Village, Keadue, Co. Roscommon",700, Co. Roscommon,3 ,233.33
34,"Scrine, Rahara, Co. Roscommon",250, Co. Roscommon,2,125.00
35,"Dun Ard, Knockcroghery, Co. Roscommon",900, Co. Roscommon,4 ,225.00
36,"No 12 Ashfield, Boyle, Co. Roscommon",875, Co. Roscommon,8 ,109.38
37,"2 Mill Cross Crescent, Athlone, Co. Roscommon",1100, Co. Roscommon,3 ,366.67
38,"8 Stoneyvale, Rooskey, Co. Roscommon",600, Co. Roscommon,4 ,150.00
39,"2 Meadowbrook, Tulsk, Co. Roscommon",550, Co. Roscommon,3 ,183.33
40,"Archbold House, Bishop St, Elphin, Co. Roscommon",2000, Co. Roscommon,15 ,133.33
41,"Lisagallon, Roscommon, Co. Roscommon, Roscommon Town, Co. Roscommon",850, Co. Roscommon,3 ,283.33
1,"41 Cnoc Na Si, Rathscanlon, Tubbercurry, Co. Sligo",700, Co. Sligo,3 ,233.33
2,"Unique Luxury Seafront Rental - Rosses Point, Rosses Point, Co. Sligo",3900, Co. Sligo,6 ,650.00
3,"Fuchsia Cottage, Calry Rd., Calry, Co. Sligo",800, Co. Sligo,3 ,266.67
4,"Caltragh, Sligo, Co. Sligo",825, Co. Sligo,3 ,275.00
5,"9 Oxfield Road, Lissadell Park, Carney, Co. Sligo",700, Co. Sligo,3 ,233.33
6,"The Hawthorns, Sligo, Co. Sligo",900, Co. Sligo,3 ,300.00
7,"Kilmactranny, Castlebaldwin, Co. Sligo",530, Co. Sligo,2,265.00
8,"Gulliver's Cottage, Beltra, Co. Sligo",475, Co. Sligo,2 ,237.50
9,"Coach Yard, Kevinsfort, Strandhill Road, Sligo, Co. Sligo",750, Co. Sligo,1 ,750.00
10,"Dooneen, Enniscrone, Co. Sligo",600, Co. Sligo,2 ,300.00
11,"Park, Kilglass, Kilglass, Co. Sligo",550, Co. Sligo,2 ,275.00
12,"Glann, Culleens, Co. Sligo",650, Co. Sligo,4 ,162.50
13,"Radharc na hAbhainn, Coolaney, Co. Sligo",700, Co. Sligo,3 ,233.33
14,"Bru na hAbhainn, Collooney, Co. Sligo",750, Co. Sligo,3 ,250.00
15,"The Windy Gap, 1 Earlsfield, Ballymote, Co. Sligo",650, Co. Sligo,4 ,162.50
16,"15 B Quay Street, Sligo, Sligo, Co. Sligo",800, Co. Sligo,2,400.00
17,"Riverwalk, Collooney, Co. Sligo",900, Co. Sligo,4 ,225.00
18,"73 Jinks Ave, Sligo, Co. Sligo",800, Co. Sligo,2,400.00
19,"2 Clogh Or, Carney, Co. Sligo",950, Co. Sligo,4 ,237.50
20,"Highfield Road, Sligo, Co. Sligo",700, Co. Sligo,1,700.00
21,"Woodtown Lodge, Pearse Road, Sligo, Co. Sligo",950, Co. Sligo,4 ,237.50
22,"Oakfield Park, Sligo, Co. Sligo",800, Co. Sligo,3,266.67
23,"Temple Street, Sligo, Co. Sligo",750, Co. Sligo,2,375.00
24,"The Drive, Ocean Links, Strandhill, Co. Sligo",1100, Co. Sligo,4 ,275.00
25,"Rathbraughan, Sligo, Co. Sligo",750, Co. Sligo,3,250.00
26,"Riocht Na Si, Ballygawley, Co. Sligo",750, Co. Sligo,4 ,187.50
27,"Radharc Na Habhann, Coolaney, Co. Sligo",650, Co. Sligo,3 ,216.67
28,"32 Knockmuldowney Park, Ballisodare, Co. Sligo",1200, Co. Sligo,4 ,300.00
29,"Charles street, Sligo, Co. Sligo",750, Co. Sligo,3,250.00
30,"2 Treacy Avenue, Sligo, Co. Sligo",800, Co. Sligo,3,266.67
31,"78 Knocknaganny Park, Sligo, Co. Sligo",800, Co. Sligo,3 ,266.67
32,"Rathglass, Enniscrone, Co. Sligo",600, Co. Sligo,2 ,300.00
33,"10 Whitecrest Village, Enniscrone, Co. Sligo",700, Co. Sligo,3,233.33
34,"8 Oaklawn, Cornageeha, Sligo, Co. Sligo",1000, Co. Sligo,4,250.00
35,"6 Temple St, Sligo, Co. Sligo",850, Co. Sligo,3,283.33
36,"2 The Laurels, Woodtown Lodge, Sligo, Co. Sligo",875, Co. Sligo,3 ,291.67
37,"Finlough, Ballinacarrow, Co. Sligo",550, Co. Sligo,2,275.00
38,"Drum Road, Rathcormac, Co. Sligo",900, Co. Sligo,4,225.00
39,"Gort Na Si, Coolaney, Co. Sligo",675, Co. Sligo,3,225.00
40,"Fermoyle, Calry, Co. Sligo",800, Co. Sligo,4,200.00
41,"Tubbercurry, Co. Sligo",600, Co. Sligo,3 ,200.00
42,"Ballymullaney, Ballinafad, Co. Sligo",600, Co. Sligo,3,200.00
43,"Grace Cottage, Seevinees, Coolaney, Co. Sligo",600, Co. Sligo,3,200.00
1,"Willowbrook, Fethard Rd., Cashel, Cashel, Co. Tipperary",900, Co. Tipperary,2,450.00
2,"9 Stephens Grove, Clonmel, Co. Tipperary",1400, Co. Tipperary,4 ,350.00
3,"25 The Chase, Clonmel, Co. Tipperary",950, Co. Tipperary,3 ,316.67
