362,"37 Simmonscourt Castle, Simmonscourt Road, Ballsbridge, Dublin 4",10000, Dublin 4,4 ,2500.00
363,"34 Huntstown Road, Huntstown, Dublin 15",1900, Dublin 15,3,633.33
364,"Mount Andrew Avenue, Lucan, Co. Dublin",1700, Co. Dublin,2,850.00
365,"Wilfield Road, Sandymount, Dublin 4",3450, Dublin 4,4 ,862.50
366,"Marianella Orwell Road, Rathgar, Dublin 6",6000, Dublin 6,5 ,1200.00
367,"Knocksinna Wood, Blackrock, Co. Dublin",2750, Co. Dublin,2 ,1375.00
368,"Bargy Road, East Wall, Dublin 3",2500, Dublin 3,3 ,833.33
369,"Proby Square, Blackrock, Co. Dublin",6000, Co. Dublin,5 ,1200.00
370,"Glandore Park, Lower Mounttown Road, Monkstown, Co. Dublin",2700, Co. Dublin,4 ,675.00
371,"Grandville Park, Newtownpark Avenue, Blackrock, Co. Dublin",3000, Co. Dublin,3 ,1000.00
372,"10 Clonkeen Crescent, Deans Grange, Co. Dublin",3200, Co. Dublin,5 ,640.00
373,"5 Lanesville Grove, Monkstown Farm, Monkstown, Co. Dublin",2700, Co. Dublin,3 ,900.00
374,"An Gort, Old Road, Rush, Co. Dublin",2300, Co. Dublin,4 ,575.00
375,"Forge Lane, Lusk, Co. Dublin",1482, Co. Dublin,2 ,741.00
376,"41 Mount Garrett Rise, Tyrrelstown, Dublin 15",1550, Dublin 15,2 ,775.00
377,"Mountpleasant Terrace, Ranelagh, Dublin 6",2100, Dublin 6,2,1050.00
378,"36 Kenilworth Manor, Harold's Cross Road, Harold's Cross, Dublin 6w",1900, Dublin 6w,2 ,950.00
379,"Seapark, Malahide, Co. Dublin",2100, Co. Dublin,3 ,700.00
380,"Elizabeth Street, Drumcondra, Dublin 9",1500, Dublin 9,2,750.00
381,"Kellys Bay, Skerries, Co. Dublin",1750, Co. Dublin,3 ,583.33
382,"Laverna Avenue, Castleknock, Dublin 15",2500, Dublin 15,4 ,625.00
383,"Jameson Orchard, Malahide, Co. Dublin",2350, Co. Dublin,3 ,783.33
384,"charlemont parade, North Strand, Dublin 3",2190, Dublin 3,2,1095.00
385,"Orpen Close, Stillorgan, Co. Dublin",2200, Co. Dublin,2,1100.00
386,"1 Airpark Court, Rathfarnham, Dublin 16",3250, Dublin 16,4 ,812.50
387,"Leopardstown Road Upper, Leopardstown, Dublin 18",2500, Dublin 18,3 ,833.33
388,"Coliemore Road, Dalkey, Co. Dublin",3000, Co. Dublin,1,3000.00
389,"Elm Mount Avenue, Beaumont, Dublin 9",2400, Dublin 9,3 ,800.00
390,"Marlborough Road, Donnybrook, Dublin 4",5900, Dublin 4,3 ,1966.67
391,"Rose Cottage, Mill Lane, Palmerstown, Dublin 20",2800, Dublin 20,2 ,1400.00
392,"Westminster Lawns, Foxrock, Dublin 18",3600, Dublin 18,4 ,900.00
393,"Kelston Avenue, Leopardstown Road, Dublin 18, Foxrock, Dublin 18",2800, Dublin 18,4 ,700.00
394,"14 Dundela Haven, Sandycove, Sandycove, Co. Dublin",1850, Co. Dublin,2,925.00
395,"Ballintyre Heath, Dublin 16., Ballinteer, Dublin 16",2800, Dublin 16,3 ,933.33
396,"Stillorgan Park Avenue, Stillorgan, Co. Dublin",5200, Co. Dublin,4 ,1300.00
397,"Spafield Terrace, Donnybrook, Dublin 4",2640, Dublin 4,4 ,660.00
398,"Wellington Road, Ballsbridge, Dublin 4",7500, Dublin 4,4 ,1875.00
399,"St. Johns, Sandymount, Sandymount, Dublin 4",3450, Dublin 4,4 ,862.50
400,"Simmonscourt Castle, Simmonscourt Road, Ballsbridge, Dublin 4",10000, Dublin 4,4 ,2500.00
401,"Clonsilla Road, Clonsilla, Dublin 15",2800, Dublin 15,4 ,700.00
402,"""Oakwood"", Chapel Road, Portmarnock, Co Dublin., Rathcoole, Co. Dublin",2800, Co. Dublin,4 ,700.00
403,"Mount pelier bohernabreena tallaght, Bohernabreena, Co. Dublin",600, Co. Dublin,2 ,300.00
404,"7 Nashville park, Howth, Dublin 13",4200, Dublin 13,5 ,840.00
405,"Silken Park, Citywest, Co. Dublin",1950, Co. Dublin,3,650.00
406,"Albany Avenue, Monkstown, Co. Dublin",4500, Co. Dublin,3 ,1500.00
407,"Ballsbridge Avenue, Ballsbridge, Dublin 4",5000, Dublin 4,3 ,1666.67
408,"Seafield Downs, Clontarf, Dublin 3",2400, Dublin 3,2 ,1200.00
409,"Seafield Downs, Clontarf, Dublin 3",2500, Dublin 3,2 ,1250.00
410,"Sorrento Road, Dalkey, Co. Dublin",4500, Co. Dublin,4 ,1125.00
411,"Drimnagh Road, Walkinstown, Dublin 12",2500, Dublin 12,6 ,416.67
412,"Killcarraig Crescent, Tallaght, Dublin 24",1950, Dublin 24,3,650.00
413,"20 Emerald Square, Dublin 8",2400, Dublin 8,2,1200.00
414,"26 Carrig Court, Citywest, Co. Dublin",1800, Co. Dublin,3 ,600.00
415,"Arnott Street, Dublin 8",3500, Dublin 8,4 ,875.00
416,"Croftwell, School Road, Rathcoole, Co. Dublin",2200, Co. Dublin,4 ,550.00
417,"10, the avenue, robswall, malahide, Malahide, Co. Dublin",3700, Co. Dublin,4 ,925.00
418,"Elm Grove, Blackrock, Co. Dublin",3600, Co. Dublin,5 ,720.00
419,"25 Arklow Street, Stoneybatter, Dublin 7",1850, Dublin 7,2,925.00
420,"iona road, Glasnevin, Dublin 9",5800, Dublin 9,6 ,966.67
421,"Allendale Square, Clonsilla, Dublin 15",1800, Dublin 15,3 ,600.00
422,"Trees Road, Mount Merrion, Co. Dublin",3200, Co. Dublin,3 ,1066.67
423,"St. Pancras Terenure, Terenure, Dublin 6",3900, Dublin 6,4 ,975.00
424,"7 Mount Garrett Crescent, Tyrrelstown, Dublin 15",1500, Dublin 15,2 ,750.00
425,"Pembroke Road, Ballsbridge, Dublin 4",5800, Dublin 4,3 ,1933.33
426,"Carysfort Villas, Killiney, Co. Dublin",1855, Co. Dublin,2,927.50
427,"Merchants Road, East Wall, Dublin 3",1800, Dublin 3,2,900.00
428,"252 GRIFFITH AVENUE, Drumcondra, Dublin 9",2500, Dublin 9,4 ,625.00
429,"71 Marina Village, Malahide, Co. Dublin",2400, Co. Dublin,3 ,800.00
430,"24 Mount Eustace Crescent, Tyrrelstown, Dublin 15",2300, Dublin 15,2 ,1150.00
431,"Daletree Avenue, Ballycullen, Dublin 24",1715, Dublin 24,3 ,571.67
432,"Brighton Gardens, Rathgar, Dublin 6",2200, Dublin 6,2,1100.00
433,"Sorrento Road, Dalkey, Co. Dublin",4860, Co. Dublin,4 ,1215.00
434,"Coliemore Road, Dalkey, Co. Dublin",4975, Co. Dublin,4 ,1243.75
435,"23 Hawthorn Terrace, East Wall, Dublin 3",2800, Dublin 3,3 ,933.33
436,"Ballyowen Avenue, Lucan, Co. Dublin",2200, Co. Dublin,4 ,550.00
437,"34 Wellington Street Upper, Dublin 7",3500, Dublin 7,3 ,1166.67
438,"11 fortfield drive, Terenure, Dublin 6",2750, Dublin 6,6 ,458.33
439,"Santa Barbara, Killiney Hill Road, Killiney, Co. Dublin",5500, Co. Dublin,4 ,1375.00
440,"12 Talbot Court, Malahide, Co. Dublin",2950, Co. Dublin,5 ,590.00
441,"8 Mayfair, Coast Road, Malahide, Co. Dublin",2000, Co. Dublin,2 ,1000.00
442,"The Coast Road, Malahide, Co. Dublin",3600, Co. Dublin,3 ,1200.00
443,"21 Belmayne Avenue, Clarehall, Dublin 13",2100, Dublin 13,3 ,700.00
444,"De Selby, Citywest, Dublin 24",2200, Dublin 24,4,550.00
445,"South Circular Road, South Circular Road, Dublin 8",3200, Dublin 8,3 ,1066.67
446,"chapel lane, Swords, Co. Dublin",1500, Co. Dublin,3,500.00
447,"Philipsburgh Avenue, Fairview, Dublin 3",2500, Dublin 3,3 ,833.33
448,"7 Huxley Crescent, Dublin 8",3600, Dublin 8,3 ,1200.00
449,"Glenfield Drive, Clondalkin, Dublin 22",2150, Dublin 22,3,716.67
450,"24 Portobello Quay, Portobello, Dublin 8",2300, Dublin 8,2,1150.00
451,"Brookfield, Kimmage, Dublin 6w",2363, Dublin 6w,4 ,590.75
452,"Fairway Drive, Dun Laoghaire, Co. Dublin",3750, Co. Dublin,5 ,750.00
453,"Longwood Park, Rathfarnham, Dublin 14",2100, Dublin 14,3,700.00
454,"Broadmeadow Road, Swords, Co. Dublin",1800, Co. Dublin,3,600.00
455,"lohunda, Clonsilla, Dublin 15",1900, Dublin 15,4 ,475.00
456,"Sundale grove, Tallaght, Dublin 24",2100, Dublin 24,3 ,700.00
457,"15 rutland st, Dublin 1",2200, Dublin 1,2,1100.00
458,"Milverton, Skerries, Co. Dublin",2400, Co. Dublin,4 ,600.00
459,"1 Liffey Hall, Lucan, Co. Dublin",2000, Co. Dublin,3 ,666.67
460,"11 Sorrel Dale, Clonsilla, Dublin 15",1970, Dublin 15,4 ,492.50
461,"61 blackthorn green sandyford, Sandyford, Dublin 18",2200, Dublin 18,3 ,733.33
462,"45 Fforster Lawn Co. Dublin, Lucan, Co. Dublin",1700, Co. Dublin,2,850.00
463,"1 Fortfield Road, Terenure, Dublin 6w",3500, Dublin 6w,4 ,875.00
464,"Grace Park Heights, Drumcondra, Drumcondra, Dublin 9",2800, Dublin 9,4 ,700.00
465,"castle farm, Shankill, Dublin 18",1800, Dublin 18,2,900.00
466,"Howth Road, Clontarf, Dublin 3",2500, Dublin 3,3 ,833.33
467,"46 Seafield Road, Clontarf, Dublin 3",3000, Dublin 3,4 ,750.00
468,"2 Diswellstown park, Castleknock, Dublin15, Castleknock, Dublin 15",3380, Dublin 15,4 ,845.00
469,"67 Grosvenor Court, Clontarf, Dublin 3",2695, Dublin 3,3 ,898.33
470,"The Hedgerows, Foxrock, Dublin 18",2100, Dublin 18,2 ,1050.00
471,"4, Lucan, Co. Dublin",1500, Co. Dublin,3 ,500.00
472,"Shanowen Avenue 34, Santry, Dublin 9",2000, Dublin 9,3,666.67
473,"Saggart Lodge Ct, Garters Lane, Saggart, Citywest, Co. Dublin",2225, Co. Dublin,4 ,556.25
474,"32 Brecan close, Balbriggan, Co. Dublin",1400, Co. Dublin,2,700.00
475,"Southdene, Monkstown Valley, Monkstown, Co. Dublin",1950, Co. Dublin,2,975.00
476,"1/30 Russell Avenue, Drumcondra, Dublin 3",1288, Dublin 3,1,1288.00
477,"48 South Dock Street, Ringsend, Dublin 4",1600, Dublin 4,2,800.00
478,"Newlands, Coliemore Road, Dalkey, Co. Dublin",2950, Co. Dublin,4 ,737.50
479,"Richmond Park, Monkstown, Co. Dublin",2300, Co. Dublin,2,1150.00
480,"Shrewsbury Wood, Cabinteely, Dublin 18",2660, Dublin 18,4 ,665.00
481,"77 Seapark Drive, Clontarf, Dublin 3",2500, Dublin 3,3 ,833.33
482,"97 Rutland Avenue, Crumlin, Dublin 12",2100, Dublin 12,3 ,700.00
483,"Merrion Park, Blackrock, Co. Dublin",2600, Co. Dublin,3 ,866.67
484,"4 Leeson Place Adelaide Road, Dublin 2",3600, Dublin 2,3 ,1200.00
485,"4 Stillorgan Gate, Upper Kilmacud Road, Dundrum, Dublin 14",4000, Dublin 14,4 ,1000.00
486,"12 Stillorgan Gate, Upper Kilmacud Road, Dundrum, Dublin 14",3200, Dublin 14,3 ,1066.67
1,"3 Melvin Cottages, Garrison, Co. Fermanagh, BT93 4ER",420480, BT93 4ER,2,210240.00
1,"Seannareeough, Furbo, Co. Galway",1200, Co. Galway,4 ,300.00
2,"Doire Uachtair, Furbo, Co. Galway",1750, Co. Galway,5 ,350.00
3,"Castel Lawn Heigh 166, Galway City, Co. Galway",560, Co. Galway,4 ,140.00
4,"An Reilean, Roscam, Co. Galway",2000, Co. Galway,4 ,500.00
5,"Sunnybank Castlegar, Castlegar, Co. Galway",1200, Co. Galway,4,300.00
6,"Cahergal, Craughwell, Co. Galway",1400, Co. Galway,4 ,350.00
7,"9 Upper Newcastle Road, Newcastle, Co. Galway",1200, Co. Galway,4 ,300.00
8,"Bunasilla, Caherlistrane, Caherlistrane, Co. Galway",950, Co. Galway,4 ,237.50
9,"37 Cottage Hill Athenry Road, Loughrea, Co. Galway",1125, Co. Galway,4 ,281.25
10,"13 Cottage Hill Athenry Road, Loughrea, Co. Galway",1125, Co. Galway,4 ,281.25
11,"Kiloughter, Menlo, Co. Galway",1270, Co. Galway,2 ,635.00
12,"56 Creig na Coille, Oughterard, Co. Galway",1100, Co. Galway,4 ,275.00
13,"Barr Na gCurrach, Furbo, Co. Galway",1250, Co. Galway,3 ,416.67
14,"Shanbally, Craughwell, Co. Galway",1750, Co. Galway,3 ,583.33
15,"Oughterard, Co. Galway",675, Co. Galway,1,675.00
16,"Oughterard, Co. Galway",900, Co. Galway,4,225.00
17,"Moycullen, Co. Galway",1000, Co. Galway,2,500.00
18,"Lemonfield Oughterard, Oughterard, Co. Galway",725, Co. Galway,1,725.00
19,"Oughterard, Co. Galway",675, Co. Galway,2,337.50
20,"Ardillaun Road, Newcastle, Co. Galway",1900, Co. Galway,3 ,633.33
21,"Frenchpark, Oranmore, Co. Galway",1300, Co. Galway,3 ,433.33
22,"Guilka, Menlough, Ballinasloe, Co. Galway",750, Co. Galway,3,250.00
23,"45 Creig Na Coille, Oughterard, Co. Galway",1000, Co. Galway,3 ,333.33
24,"Bealach na Gaoithe, Tuam, Co. Galway",1000, Co. Galway,3 ,333.33
25,"Lenaboy Park, Salthill, Co. Galway",2000, Co. Galway,3 ,666.67
26,"Crossford, Gort, Gort, Co. Galway",850, Co. Galway,3,283.33
27,"Grange, Corrandulla, Corrandulla, Co. Galway",1500, Co. Galway,4 ,375.00
28,"Teal Cottage, Lough Cultra Castle, Gort, Co. Galway",900, Co. Galway,3 ,300.00
29,"Rinville Village, Oranmore, Rinville, Co. Galway",1100, Co. Galway,2 ,550.00
30,"Newgrove, Newbridge, Co. Galway",750, Co. Galway,4 ,187.50
31,"No 6 St Annes, Newcastle Road, Dangan, Co. Galway",1795, Co. Galway,2 ,897.50
32,"Ballybane Road, Ballybane, Co. Galway",320, Co. Galway,3 ,106.67
33,"47 Caiseal Cam, Roscam, Co. Galway",2200, Co. Galway,5 ,440.00
34,"Maoilin, Ballymoneen, Co. Galway",1600, Co. Galway,3 ,533.33
35,"42b Woodfield Knocknacarra, Knocknacarra, Co. Galway",1800, Co. Galway,3 ,600.00
36,"Gentian Hill, Salthill, Co. Galway",4200, Co. Galway,6 ,700.00
37,"Kilbeg Clonbur, Clonbur, Co. Galway",520, Co. Galway,4,130.00
38,"Renville Village, Oranmore, Co. Galway",1100, Co. Galway,2 ,550.00
39,"Cappagh, Dunmore, Co. Galway",700, Co. Galway,3,233.33
40,"Newbridge, Mountbellew, Co. Galway",700, Co. Galway,4,175.00
41,"""Willow Cottage"", Cloonmore, Tuam, Co. Galway",850, Co. Galway,3,283.33
42,"Gardenfield, Tuam, Co. Galway",1100, Co. Galway,5 ,220.00
43,"The Haven, Clybaun, Knocknacarra, near Salthill, Clybaun, Co. Galway",1600, Co. Galway,3 ,533.33
44,"Tiernea, Lettermore, Co. Galway",700, Co. Galway,4 ,175.00
45,"Moyola Park, Newcastle, Co. Galway",2720, Co. Galway,5,544.00
46,"13 Cottage Hill, Athenry Road, Loughrea, Loughrea, Co. Galway",1125, Co. Galway,4 ,281.25
47,"37 Cottage Hill 35 'RADHARC NA SLEIBHTE',Athenry, Loughrea, Co. Galway",1125, Co. Galway,4 ,281.25
48,"Grange, Cregmore, Co. Galway",799, Co. Galway,4,199.75
49,"Grange, Turloughmore, Co. Galway",799, Co. Galway,4,199.75
50,"Ashbrook, Oranmore, Co. Galway",1700, Co. Galway,4 ,425.00
51,"95A Renville Village, Oranmore, Co. Galway",950, Co. Galway,2 ,475.00
52,"Murrough Drive, Renmore, Co. Galway",1600, Co. Galway,5 ,320.00
53,"Cregmore, Cregcarragh, Claregalway, Co. Galway",1250, Co. Galway,4 ,312.50
54,"Lisheenkyle East, Oranmore, Co. Galway",1700, Co. Galway,5 ,340.00
55,"Ballybrit Heights, Ballybrit, Co. Galway",520, Co. Galway,4 ,130.00
56,"11 Ashbrook close, Mountbellew, Co. Galway",850, Co. Galway,5 ,170.00
57,"Hardwood, Kiloran, Aughrim, Co. Galway",700, Co. Galway,3,233.33
58,"Ashfield Drive, Ballinasloe, Co. Galway",900, Co. Galway,3 ,300.00
59,"Boireann Bheag, Roscam, Co. Galway",1800, Co. Galway,4 ,450.00
60,"Main Street, Craughwell, Co. Galway",800, Co. Galway,3,266.67
61,"172 Fearran Ri, Galway City, Co. Galway",1600, Co. Galway,4 ,400.00
62,"Carraig Mor, Loughrea, Co. Galway",1100, Co. Galway,4 ,275.00
63,"75 coill clocha, oranmore, galway, Oranmore, Co. Galway",1650, Co. Galway,5 ,330.00
64,"Dun na Coiribe, Galway City, Co. Galway",600, Co. Galway,5 ,120.00
65,"Water Lane, Bohermore, Galway City, Co. Galway",560, Co. Galway,5 ,112.00
66,"55 Riverdale, Oranmore, Co. Galway",1350, Co. Galway,4 ,337.50
67,"Abbey Court, Portumna, Co. Galway",800, Co. Galway,3 ,266.67
68,"219 Lurgan Park, Renmore, Co. Galway",1800, Co. Galway,3,600.00
69,"219 Lurgan Park, Renmore, Renmore, Co. Galway",1800, Co. Galway,3,600.00
70,"Barnagorteeny, Glann Road, Oughterard, Co. Galway",850, Co. Galway,3,283.33
71,"Portacarron, Oughterard, Co. Galway",1250, Co. Galway,3 ,416.67
72,"27 Abbey Glen, Knockaunglas, Athenry, Co. Galway",1200, Co. Galway,4 ,300.00
73,"Clos Na Feirme, Clonbur, Co. Galway",940, Co. Galway,3 ,313.33
74,"Tullinadaly Rd, Tuam, Co. Galway",750, Co. Galway,3,250.00
75,"Castlelawn Heights, Headford Road, Co. Galway",1600, Co. Galway,4 ,400.00
76,"85 Hazelwood, Loughrea, Co. Galway",1300, Co. Galway,4 ,325.00
77,"22 St. Brendan's Avenue, Woodquay, Co. Galway",1400, Co. Galway,3 ,466.67
78,"Carrig Weir Tuam Co. Galway, Tuam, Co. Galway",850, Co. Galway,3 ,283.33
79,"Misneach, Killeeneenmore, Craughwell, Clarinbridge, Co. Galway",2050, Co. Galway,5 ,410.00
80,"Kilagoola, Moycullen, Co. Galway",950, Co. Galway,2,475.00
81,"Kilconnell, Ballinasloe, Co. Galway",850, Co. Galway,4 ,212.50
82,"Moyleen, Loughrea, Co. Galway",1300, Co. Galway,4 ,325.00
83,"No. 9 The Granary, Abbey, Co. Galway",700, Co. Galway,3 ,233.33
84,"1 corrib terrace woodquay, Galway City, Co. Galway",1860, Co. Galway,4,465.00
85,"Williamstown County Galway, Williamstown, Co. Galway",650, Co. Galway,5,130.00
86,"Rosshill, Oranmore, Co. Galway, Rosshill, Co. Galway",3500, Co. Galway,6 ,583.33
87,"Cahergal, Tuam, Co. Galway",900, Co. Galway,3 ,300.00
88,"., Cornamona, Co. Galway",700, Co. Galway,3,233.33
89,"Berties cottage, derrigimbla, clifden, Clifden, Co. Galway",900, Co. Galway,3,300.00
90,"Glenbrack, Galway Road, Gort, Co. Galway",950, Co. Galway,2,475.00
91,"Cnoc na Ri, Clybaun Road, Knocknacarra, Co. Galway",1800, Co. Galway,4 ,450.00
92,"Deerpark, Kilconly, Co. Galway",750, Co. Galway,5 ,150.00
93,"Near Clybaun Rd, Clybaun, Co. Galway",1700, Co. Galway,4 ,425.00
94,"Main street, Loughrea, Loughrea, Co. Galway",1000, Co. Galway,4 ,250.00
95,"178 Rosan Glas, Rahoon, Co. Galway",2000, Co. Galway,4 ,500.00
96,"Ballymore, Ballinderreen, Co. Galway",1100, Co. Galway,3 ,366.67
97,"Rooaunmore, Claregalway, Co. Galway",1100, Co. Galway,3 ,366.67
98,"3 Pairc An Tempaill, Creggs, Co. Galway",700, Co. Galway,3 ,233.33
99,"Ivy house, kilbricken, Rosmuc, Co. Galway",950, Co. Galway,4 ,237.50
100,"Croi na mBhaile, Carrabane, Loughrea, Co. Galway",950, Co. Galway,4,237.50
101,"5 Devon Court, Salthill, Co. Galway",2950, Co. Galway,5 ,590.00
102,"truskey East, Barna, Co. Galway",1500, Co. Galway,3,500.00
103,"New Line Athenry Galway, Athenry, Co. Galway",2450, Co. Galway,5 ,490.00
1,"Maple Road, Ard na Greine, Milltown, Co. Kerry",850, Co. Kerry,4 ,212.50
2,"Taulaght, Tralee, Fenit, Co. Kerry",1400, Co. Kerry,6 ,233.33
3,"Beenoskee, Ballyard, Tralee, Co. Kerry",1200, Co. Kerry,4 ,300.00
4,"Main Street, Causeway, Co. Kerry",550, Co. Kerry,2,275.00
5,"Hillside, Poulawaddra, Tralee, Co. Kerry",750, Co. Kerry,3 ,250.00
6,"Churchill, The Spa, Fenit, Co. Kerry",1000, Co. Kerry,4 ,250.00
7,"Opulent Secluded Rental, Killarney, Co. Kerry",2350, Co. Kerry,4 ,587.50
8,"Rossdara, Muckross Road, Killarney, Co. Kerry",1250, Co. Kerry,4 ,312.50
9,"Caherslee, Tralee, Co. Kerry",900, Co. Kerry,3 ,300.00
10,"5 ardmullen kenmare, Kenmare, Co. Kerry",1250, Co. Kerry,8 ,156.25
11,"Ardmullen, Kenmare, Co. Kerry",1050, Co. Kerry,3 ,350.00
12,"The Sands, Ballybunion, Co. Kerry",850, Co. Kerry,4 ,212.50
13,"Sli Na Speire, Clieveragh, Listowel, Co. Kerry",600, Co. Kerry,3 ,200.00
14,"Ardea, Tuosist, Kenmare, Co. Kerry",900, Co. Kerry,3 ,300.00
15,"Fossa, Killarney, Co. Kerry",1290, Co. Kerry,5 ,258.00
16,"Basin Court, Tralee, Co. Kerry",708, Co. Kerry,3,236.00
17,"Fenit Atlantic Village, Fenit, Co. Kerry",685, Co. Kerry,3 ,228.33
18,"Lassaboy, Castlemaine, Co. Kerry",950, Co. Kerry,3 ,316.67
19,"Finihy Woods, Tullakeel, Co. Kerry",1050, Co. Kerry,3 ,350.00
20,"East End, Ballybunion, Co. Kerry",750, Co. Kerry,3,250.00
21,"Ardoughter Ballyduff, Ballyduff, Co. Kerry",800, Co. Kerry,4 ,200.00
22,"Brackhill, Castlemaine, Co. Kerry",650, Co. Kerry,4,162.50
23,"Ref 792 - No. 6 Cois Tra, Ballinskelligs, Co. Kerry",850, Co. Kerry,3 ,283.33
24,"Ref 788 - Cottage, Old Post Office Street, Cahersiveen, Co. Kerry",650, Co. Kerry,2,325.00
25,"Ref 790 - No. 5 Cois Tra, Ballinskelligs, Co. Kerry",750, Co. Kerry,3 ,250.00
26,"Mountway, Ballyheigue, Co. Kerry",700, Co. Kerry,3 ,233.33
27,"Fossa, Killarney, Co. Kerry",1190, Co. Kerry,4 ,297.50
28,"Fountain court Tralee, Tralee, Co. Kerry",700, Co. Kerry,2,350.00
29,"Templenoe, Kenmare, Co. Kerry",975, Co. Kerry,3 ,325.00
30,"SEAVIEW HOUSE, CURRAHEEN, Tralee, Co. Kerry",750, Co. Kerry,3 ,250.00
31,"Kealduv, Glenbeigh, Co. Kerry",750, Co. Kerry,3 ,250.00
32,"The Stables Cottage, Killorglin, Co. Kerry",625, Co. Kerry,1,625.00
33,"Shandrum, Kilgarvan, Co. Kerry",800, Co. Kerry,4 ,200.00
34,"Termons Upper, Waterville, Co. Kerry",975, Co. Kerry,3 ,325.00
35,"Tiernaboul, Killarney, Co. Kerry",1000, Co. Kerry,4 ,250.00
36,"Sunhill, Killorglin, Co. Kerry",900, Co. Kerry,4 ,225.00
37,"Ardcanaught House, Castlemaine, Co. Kerry",625, Co. Kerry,4 ,156.25
38,"Droum, Glenbeigh, Co. Kerry",750, Co. Kerry,4 ,187.50
39,"No. 48 Knocklyne Valley, Sunhill, Killorglin, Co. Kerry",800, Co. Kerry,3 ,266.67
40,"Baile An Tooreen, Killorglin, Co. Kerry",800, Co. Kerry,3 ,266.67
41,"The Crescent Greenfileds Firies Killarney, Killarney, Co. Kerry",900, Co. Kerry,3 ,300.00
42,"29 Clarin Wood, Rathmore, Co. Kerry",1000, Co. Kerry,5 ,200.00
43,"Laune View, Killorglin, Co. Kerry",400, Co. Kerry,1,400.00
44,"29 Langford St, Killorglin, Co. Kerry",700, Co. Kerry,3 ,233.33
45,"Teachers Lodge Ownagarry, Killorglin, Co. Kerry",900, Co. Kerry,4 ,225.00
46,"Caragh Glen, Caragh Lake, Killorglin, Co. Kerry",850, Co. Kerry,3 ,283.33
47,"Ballinvosherig West, Tralee, Co. Kerry",900, Co. Kerry,4 ,225.00
48,"Main St., Killorglin, Co. Kerry",675, Co. Kerry,3,225.00
49,"Langford Downs, Killorglin, Co. Kerry",700, Co. Kerry,2,350.00
50,"Glenduff, Kielduff, Tralee, Co Kerry, Tralee, Co. Kerry",700, Co. Kerry,3,233.33
51,"Abbeydorney Road, Tralee, Co. Kerry",750, Co. Kerry,3,250.00
52,"The Grove, Mounthawk, Tralee, Co. Kerry",1250, Co. Kerry,4 ,312.50
53,"Kells, Glenbeigh, Co. Kerry",750, Co. Kerry,3 ,250.00
54,"Cois Tra, Ballinskelligs, Co. Kerry",1600, Co. Kerry,3 ,533.33
55,"29 Waterville Links, Waterville, Co. Kerry",850, Co. Kerry,3 ,283.33
56,"Abbeylands, Milltown, Co. Kerry",800, Co. Kerry,3 ,266.67
57,"Knockavota, Milltown, Co. Kerry",700, Co. Kerry,3,233.33
58,"Crystal Fountain, Tralee, Co. Kerry",1000, Co. Kerry,3 ,333.33
59,"Rathscannell, Abbeydorney, Co. Kerry",650, Co. Kerry,4,162.50
60,"3 Kerins Park, Tralee, Co. Kerry",750, Co. Kerry,3,250.00
61,"2 St. John's Court, Tralee, Co. Kerry",900, Co. Kerry,3 ,300.00
62,"Gortreagh Cottage, Fossa, Co. Kerry",700, Co. Kerry,2,350.00
63,"2 Brook Lodge Killarney Rd., Kenmare, Co. Kerry",1100, Co. Kerry,4 ,275.00
64,"Brackhill, Castlemaine, Co. Kerry",600, Co. Kerry,4,150.00
65,"Ard Carraig, Kenmare, Co. Kerry",900, Co. Kerry,3 ,300.00
66,"Lerrig South, Ardfert, Co. Kerry",950, Co. Kerry,4 ,237.50
67,"Beech Green, Caherdown Woods, Listowel, Listowel, Co. Kerry",800, Co. Kerry,3 ,266.67
1,"Riverside, Portarlington, Co. Laois",1000, Co. Laois,3 ,333.33
2,"8 powerscourt Portlaoise, Portlaoise, Co. Laois",1100, Co. Laois,3 ,366.67
3,"The Grange, Portlaoise, Co. Laois",1050, Co. Laois,3,350.00
4,"The green,Main Street, Stradbally, Co. Laois",800, Co. Laois,2,400.00
5,"Woodgrove, Ballyfin Rd, Portlaoise, Co. Laois",975, Co. Laois,3 ,325.00
6,"Doire og,derry, Rosenallis, Co. Laois",900, Co. Laois,3 ,300.00
7,"Boughlone Way, Bellingham, Portlaoise, Co. Laois",1200, Co. Laois,3 ,400.00
8,"Rossvale, Mountmellick Road, Portlaoise, Co. Laois",1150, Co. Laois,4,287.50
9,"Rathevan Heights, Portlaoise, Co. Laois",1200, Co. Laois,4 ,300.00
10,"4 Ossory Court, Borris-in-Ossory, Co. Laois",900, Co. Laois,5 ,180.00
11,"88 The Glen, Kilnacourt Woods, Portarlington, Portarlington, Co. Laois",1000, Co. Laois,3,333.33
12,"14 Clarney Hall, Rathdowney, Co. Laois",850, Co. Laois,3 ,283.33
13,"Glenkeen Park, Fairgreen, Portlaoise, Co. Laois",950, Co. Laois,3 ,316.67
14,"Clondarrig Court, Bellingham, Portlaoise, Co. Laois",1050, Co. Laois,3 ,350.00
15,"Rossdarragh Glen, Rathevan, Portlaoise, Co. Laois",975, Co. Laois,3 ,325.00
16,"Ivy House, The Heritage Golf & Country Club, Killenard, Co. Laois",4800, Co. Laois,5 ,960.00
17,"Rathevan Close, Portlaoise, Co. Laois",900, Co. Laois,2 ,450.00
18,"Dublin Road, Rathbrennan, Portlaoise, Co. Laois",1250, Co. Laois,5 ,250.00
19,"No.34 Ashley Gardens, Portlaoise, Co. Laois",1200, Co. Laois,3 ,400.00
20,"No.18 Bluebell Way, Portlaoise, Co. Laois",1100, Co. Laois,3 ,366.67
21,"Lake Court, Kilminchy, Portlaoise, Co. Laois",1250, Co. Laois,5 ,250.00
22,"woodbrook mountrath, Mountrath, Co. Laois",900, Co. Laois,4 ,225.00
23,"Pine Villa, Portarlington, Co. Laois",950, Co. Laois,3 ,316.67
24,"2 Grattan place, Portlaoise, Co. Laois",1000, Co. Laois,3 ,333.33
25,"New Inn, Emo, Co. Laois",2500, Co. Laois,5 ,500.00
26,"Lake Grove, Kilminchy, Portlaoise, Co. Laois",1100, Co. Laois,4 ,275.00
27,"Sweetview, Abbeyleix, Co. Laois",850, Co. Laois,3,283.33
28,"the strand road, Ballickmoyler, Co. Laois",600, Co. Laois,1,600.00
29,"The Sycamores, Kilnacourt Woods, Portarlington, Co. Laois",1100, Co. Laois,3 ,366.67
30,"2 lake grove, Kilminchy, Portlaoise, Co. Laois",1000, Co. Laois,2 ,500.00
31,"No.24 Erkindale Drive, Durrow, Co. Laois",1000, Co. Laois,3,333.33
32,"44, lake drive, Kilminchy, Portlaoise, Co. Laoise, Portlaoise, Co. Laois",1000, Co. Laois,3 ,333.33
33,"Radharc Na Sleibhte, Shannon Road, Mountrath, Co. Laois",900, Co. Laois,3 ,300.00
1,"Drumanure, Carrigallen, Co. Leitrim",650, Co. Leitrim,4 ,162.50
2,"Mullagh, Dromahair, Co. Leitrim",550, Co. Leitrim,1,550.00
3,"acorn woods, Leitrim, Co. Leitrim",800, Co. Leitrim,4 ,200.00
4,"Hyde St, Mohill, Co. Leitrim",500, Co. Leitrim,3 ,166.67
5,"Lord Leitrim Court , Rynn Castle Estate, Mohill, Co. Leitrim",590, Co. Leitrim,3 ,196.67
6,"Earls Court, Lough Rynn Estate, Mohill, Co. Leitrim",580, Co. Leitrim,3 ,193.33
7,"Cornaroy, Drumshanbo, Co. Leitrim",500, Co. Leitrim,3,166.67
8,"2 Cluain Alainn, Carrigallen, Co. Leitrim",650, Co. Leitrim,4 ,162.50
9,"21 Anville Court, Ballinamore, Co. Leitrim",550, Co. Leitrim,3 ,183.33
10,"Jacob's Well, Druminalass, Ballinagleragh, Co. Leitrim",600, Co. Leitrim,6 ,100.00
11,"Ardrum, Ballinamore, Co. Leitrim",500, Co. Leitrim,3,166.67
12,"38 Carbery Coast, Tullaghan, Co. Leitrim",750, Co. Leitrim,4 ,187.50
13,"15 Hillcrest, Stonebridge, Dromahair, Co. Leitrim",650, Co. Leitrim,3 ,216.67
14,"10 MacRaghnaill Court,Lough Rynn, Mohill, Co. Leitrim",550, Co. Leitrim,3 ,183.33
15,"Clement's Court, Lough Rynn, Mohill, Co. Leitrim",500, Co. Leitrim,3 ,166.67
16,"1 Clooneen Park, Manorhamilton, Co. Leitrim",650, Co. Leitrim,3 ,216.67
17,"9 Beechcourt, Newtowngore, Co. Leitrim",500, Co. Leitrim,3 ,166.67
18,"The Waterfront, Dromod, Co. Leitrim",700, Co. Leitrim,3,233.33
19,"cortober, Carrick-on-Shannon, Co. Leitrim",750, Co. Leitrim,3 ,250.00
20,"Glenfarne Road, Kiltyclogher, Co. Leitrim",485, Co. Leitrim,3,161.67
21,"Conray Glencar, Manorhamilton, Co. Leitrim",850, Co. Leitrim,3 ,283.33
22,"Glenfarne Road, Kiltyclogher, Co. Leitrim",485, Co. Leitrim,3,161.67
23,"Main Street, Carrigallen, Co. Leitrim",550, Co. Leitrim,3 ,183.33
1,"Galtee View House, Ballylanders, Co. Limerick",1650, Co. Limerick,4 ,412.50
2,"Richmond Park, Corbally, Co. Limerick",1400, Co. Limerick,4 ,350.00
3,"The Meadows, Lower Park, Corbally, Co. Limerick",1600, Co. Limerick,4 ,400.00
4,"Meanus South, Meanus, Co. Limerick",1000, Co. Limerick,2,500.00
5,"Cragaun, Raheen, Co. Limerick",1500, Co. Limerick,4 ,375.00
6,"6 Owenmore Drive, Raheen, Co. Limerick",1250, Co. Limerick,3 ,416.67
7,"The Paddocks, Briarfield, Castletroy, Co. Limerick",1250, Co. Limerick,3,416.67
8,"Golf links road, Castletroy, Co. Limerick",1480, Co. Limerick,4 ,370.00
